43528	dipsy tells truth day lies next day alternatelyif today tell truth tomorrow lying days later tell truth onlala tells truth days lies next days alternatelyif today tomorrow tell truth days days later lying onpoo tells truth days lies next days alternatelyyou know one dipsi one poo one lalayou ask yesno question yesno answerevery question ask person cost dollarswaiting day ask cost dollarsif ask non yesno question fined dollars get answerhow many dollar minimum prepare asking identify one dipsi one poo one lalanote answer im sure whether answer best answer
90634	place every number one three lists p q number p added number q gives prime fewest number elements note p q emptygood luck
68107	roommate rm morning suddenly give riddle rm hi good morning nice riddle seriously isnt early rm mon guess change youll find phone next change twice youll find sea behind dont change trust change trust said two things make exist
10765	following image represents word way makes sense american english british englishwhat wordhint describe image way would make sense clue cryptic crossword crossword entry would given clue word need
55823	old wont disappear soonevery day go feel mesome says fictional visibleonly happy really saw mei move following one path faster soundwho amhint fast slow time always shapehint see fellow moonhint famous character took name
35347	moved although may move meyou hold easily show mefast slow speed never changedi outlast least gone
92693	always find hard codewords puzzles whenever fill spaces starting letters doesnt really help always end looking answer sheet anybody know good strategy codewords
123415	let k k even n odd mary play n chess games parents alternating father mother receive allowance must win k games row given choice start stronger weaker parentthe puzzle source apparently peter winkler
57879	average series x new data point comes value x new average less x possible
80411	cave wind hasnt stories pirates demons landsall nothing isnt masterworks science revolve bout youll blind aint rock sun hasnt still fear one one doesnt let gotell iedit seemed nothing isnt standalone line merged second lineedit edit made four answers apologies thissince answers almost right answer ill add couple lines describing wont havent poseidon apollo half food black white chopper plane literature worships horrible aint
72220	four men enter empty room doors windows entrances exits walls floor ceiling extra thicc break way wayhow men get outps got way got
8731	cosmo puts golden weight gram right pan balancethen fredo starts adding bronze weights balance first fredo adds bronze weight gram one pans adds bronze weight gram one pans adds bronze weight gram one pansthen adds bronze weight gram one pansand onevery bronze weight weighs twice much preceding oneafter fredo time two pans equilibriuma possible fredo put gram bronze weight left panb possible fredo put gram bronze weight right pan
70172	know youre addicted riddles use head move earth ancient none recall birth one spells death yet youd call ill bet know well youve got card isnt hard game fortune dice roll name goal two kinds one chance speak name head thick wet braided hair carry seen wake brightening glare slick treacherous sheen story short often told hands would hold string tightens loose weight remain full desired fate woven plastic skin nothing coin fish within travel pressed many hips surely name lips random chance see fold one old vibrant grid break back colours prime lack difficult try tell im something antique feel binding thing hold seal breaking takes strength weakness time unknown length made many kept know name speak clever folk read less clever folk ask instead stole likeness home else without direction roam providing clues familiar game tell whats name im doll strings steps one hole things unless torn blown wind blows ill help see name
29217	diophantus alexandria greek mathematician lived third century ad diophantus wrote series books called arithmetica lost among many problems arithmetica contained following mathematical puzzlea man bought several liters two kinds wines paid drachmas perliter fine wine drachmas per liter ordinary winethe total sum money paid equal square total quantityof bought wine expressed litersthe task find quantities kind winein solving puzzle assume man bought nonnegative integer numbers liters types wine puzzle allows one solution task determine solutions
16929	hell little old lady named mrs dunham livesmrs dunham oldfashioned ladymrs dunham bit drinking problemthree times day every day drinkswhat times day drink drinkthanks viewing first puzzle promise everything need solve funnotes drink water mrs dunham surprisingly healthy old lady take medicine need vitamins drink question addition drinks served breakfast lunch dinner whatever terms use regular meals hospitals hell know safely count potential answersokay add riddle help broad hope term isnt used disparage poor mrs dunham let say thismrs dunham bit used warmer climates drink imported popular hell hometownthe three times day directly linked drink old reasonsthe drink question much popular southern state made
6691	challenge wordpuzzle lovers might bit game puzzle think limitless answers final answer could found eventuallywhat longest list growing anagrams put grammatically correct english sentenceexample clarificationstart word add words list one additional letter one letters may rearranged ie anagrams word allowediin pin alternatively nip pain alternatively pian paint alternatively inapt may add letter list valid put words single english sentence grammatically correct meaningful ini paint pin pain says painter painting shopname pin needle onto wall severe backacheso aim find single sentence using words list ie wordlength appears exactly oncerulesdiacritics may handled group represented simplest form ä á allow flexibility solutionsthe shortest word list may length single letter list contain single word length shortest longest wordyou may use arbitrary punctuation sentence compound words count single wordnames acronyms allowed used give reference validityif meaning sentence apparently clear give little example could appear see example aboveall words list appear exactly sentencebonusthis puzzle english language good example please post also accepted answer though
12838	tetrahedron solid shape four triangular faces necessarily regular identical show partition solid cube tetrahedra congruent meaning identical translation rotation possibly reflectionits easy find solutions googling please solve
2602	sheikh dies leaving behind three sons camels following orderhis oldest son shall inherit one two camelshis middle son shall inherit one three camelshis youngest son shall inherit one nine camelsnow three dont know ask old friend family knows solution everyone happywhat propose
51757	relocate one line find equality trickynote inequality sign accepted
55853	special kind parking lot stores special x cars move adjacent squares including diagonals empty provided car occupies square every car occupies exactly one square exit beside top left corner parking lot everyone perfect driver everyone parks way every car exit without moving cars currently cars parked parking lot kind fit cars different arrangement
107055	posted problem deleted area math puzzles proposal wellreceived obviously didnt get answer still dont know answer im even sure solved pure mathematics im still curious goesimagine × checkerboardif remove two opposite corner squares board well known cant tile dominoesbut remove two squares opposite color one black one white also known always tile dominoesthen following statement true falseif remove two black two white squares removing four total resulting board still connected always tile remaining squares dominoes
10797	thinking analysis mathematical problems came puzzlejust like magic square one fill different numbers p p dots p times grid time numbers must different prime numbers addition sums horizontal vertical diagonal must different prime numbers among also different numbers grid words p p dots p dots must different prime numbersi suppose infinitely many solutions challenge minimize sum dots one answer foundthe total sums believe likely solutions beat total welcome tryupdate plus spoiler alert verified using computer program one answers accepted answer optimal solution beaten optimal solutions actually rotate one solutions degrees also horizontally flip resulting grid get answers hence openended tag removed
64049	puzzle find two words anagrams fit example might place earth heartafter many hours jane played sour piano whole ruinedmark placed deep blue suzy bought shoes watching john grab hot oats steve recommended cool downwhile driving first time luke remember around side roadjimmy complained smoothie sour sweetafter picking prickly red tashas hand proofreading article healthy tom realized needed make serious wash hands clean joan likes hot cup
33332	keeper siblingi friend decision makeri annoying worki scary forestwho ihint sibling samehint like boxeshint popular wall streethint found travel documenthint bitehint russian call little birdhint found kinds phallic objectshint comics superherohint boomhint checkfinal hint yes
14903	cut nothing missed open surprised fruit youll loved though im animal youll doomedwho
125508	warmup questioneach five cities connected others four roads show possible roads intersect exactly two roads crossing single intersection junctions cities considered intersectionsone possible solution black circles represent cities yellow lines represent nonintersecting roads blue lines represent roads intersect red dot represents point intersectionmain questioneach six cities connected others five roads show possible roads intersect three times exactly two roads crossing intersection junctions cities considered intersectionsthe six cities question leningrad mathematical olympiad
16968	friend pictures wall think hes crazy aboutthese pictures common link correct answer explain image wayhintthe title also clue
68168	fashionable part blues whatever dont choose start r messages go far maybe snoozewhat
37449	come via latin greek step direction something big speak scholars know well without may fail provide helping hand found sometimes flowers small though stepping stone always minor always make dependent finerwho inote sure wordplay tag think therehint everyone come across thing middlehigh school college us ignores wholeheartedly
55885	english words contain five vowel letters e u fewest consonant lettersfacetious abstemious contain five alphabetical order contains four consonant letters fcts facetious bstm abstemious two instances case abstemious counting letter words achieve consonant score fourwe looking word words contain five vowel letters necessarily alphabetical order perhaps repeated lowest consonant scorenote please nobody edit change vowel letter consonant letter vowel consonant vowels consonants sounds classes phonemes classes written letters often vowel letter represent vowel also aware often represent vowel w sometimes
25165	known logicians get drunk may claim know answer question know wellafter night heavy drinking bar three logicians decide time leave walk place barman asks anybody able drive back homethe first logician says dont knowthe second logician says dont knowthe third logician says dont knowhow many logicians must drunk minimum provide reasoning
78413	im offering someone origami rabbit shape qr code written inside beginning series riddlesmy question could make person im offering origami understand must open foldingwhat kind sentence could write aside present would think unfolding destroying present gave obvious manner obviouslyedit ive mixed idea heres ive ended cest ici que tout commence il suffit de défaire ce qui été fait means begins simply undo done french suggested boboquack full ear showing qr code yeah wanted sure got ahahyou really creative theres lot interesting ideas ill keep aside especially stories untold watch one unfold bass thanks replies guys
111184	abcd digit number abc distinctly separate digits using following math operations digits abc exactly get number abcdmath operations allowed x square root parenthesis concatenationthere least solutions answer use least number math operations gets tickplease programming
10836	mortals bewarea divine trapped square silences prayersuntil step stairs powers make millionairethe one spear beneath future heirfour make pairs hint beneath future heir relevance line replaced future heir hint one spear hehe one weapon
14933	taken doorknob hostage cellar perfectly trapped solid walls solid floor solid roof windows etc way steel door way unlock door means twopan balance scale accurate quacogrami provided weights weight nonzero positive integer weight quacograms accurately written must put nonzero number weights either side scale pans balance perfectly trickery weights allowed weights doorknob computer writing implements also always able somehow manoeuvre weights matter weights might select weights weights may never escape might minimise total weight achieved lowest highest weight weight must achieved much wood must woodchuck chuck kidding das always explanationsproofs maybe important figures
35413	see cousins park mall dont worry small sign status inside dividing apparatus parents looked adored children certainly abhor maximize ive got long trips spare cotfirst riddle hints needed ill certainly give themedit seems little harder thought wheres two hintshint personally wheels upon move object im part play music groovehint decade popular people flop big lady helen lost topseems need another hint think second third basehrmph gives away mobile attached
125524	purposes puzzle chess position consists arrangement pieces board well side move information game state includedthe objective puzzle identify position occur twice single game occur three timesmore generally numbers n position occur n times n timesnote using fide ruleset fold repetition move rules optional players call basically irrelevant puzzle fold move rules mandatory may may useful solution
107107	well known way arranging queens checker board way every square occupied threatenednow consider slight variation need cover one colorcan place queens standard x checker board every white square occupied threatenedbonus queens allowed attack
43620	find table believe capable soar beings pour think im dizzy im actually busy im near hence dont support anyone dear
35429	reveal hidden secrets nanoscale put exist honker maybe carapace ihint maybe im quite animalhint bourne carapacehint honker animal known honking nose
31337	simply complete sudoku crossword happy puzzlingacross achieved acclaim knowledgable strange apron explode asteroid five refrain inactivity evade others clip rewire curtail current repeat unassignedabbreviation value disregarding sign six pack differentiable group three hundred seventeen head heels invert stripped hypnotist even unusual sequence games forming part match southern alien synthesis tritium tungsten oxygen smallest sized compound never say backwards without right level ground plural singular belonging truly scan partly increments something measure core income trick menu meal one thing goes another finitely generated free abelian group spanning real space tarts holey top mistakenly disprove supplies take unordered subsets set transforming savvier transcendental ratio used smell rotten say certainly unmistakable beer infinite acidity “ infinity plus one ” create cut corn mess covering street ordered classification cockney girl process losing sense map fro adds charged particle information limitless projector pigeonholed personalities deluded chart races staggering credential woven adulterating awkwardly yielded location angles introductions diminutive asian new leader nations reason following headless fellows litigating journal ship confused blind tourist short fifty generalised functions study arrangements deranged manic robotics addendum mathcal f gammadeltaphigammagammaphidelta textclues mathcal ftextclues textremainderalpha psipsiomegapsipsiomega h – dhα → space boxhint z currently sudoku clues unmatched possible solutionshint z going give hint across go realised made error edited numbers clues one greater listed except across edited day posted due comments crossword numbering convention hint therefore even greater fault course nowwhere across gohint z could textclues textremainder equation textclues mathcal ftextclues textremainderhint z partially solved sudoku community wiki post present fully resolved cells one logically fill letters yet present
25194	less one maker often said mightiest usalone smite yet greater notwho
14953	solving myiqnets questions later saw results answered wrongly even getting know right answer couldnt manage find logic help hereplease mark city matching others sydneyparisbuenos airesmoscowanswer sydneywhich missing drawing answer cwhich metal odd one coppertinironbronzeleadanswer bronzefind missing card answer
23150	abraham van helsing jonathan harker play game count draculathe three players agree following rules count dracula van helsing enter crypt jonathan harker wait outside crypt contains coffins numbered together golden lockets engraved numbers numbers occurs exactly one coffin exactly one locket count dracula puts lockets coffins every coffin contains exactly one locket van helsing observes knows exactly locket coffin van helsings turn van helsing may pick pair coffins switch lockets two coffins dracula observes action van helsing van helsing leaves crypt back door jonathan harker gained additional knowledge choices dracula van helsing first three steps enters crypt count dracula chooses integer n le nle announces n jonathan jonathan allowed perform search steps following form jonathan chooses coffin opens checks whether locket coffin carries number n jonathan harker finds locket number n search steps van helsing game case allowed drive wooden stake draculas heart harker manage find locket number n count dracula allowed drink van helsings harkers blood last remaining drop harker van helsing discuss options want agree good strategyif harker chooses coffins simply random team harker van helsing probability winning game strategy would guarantee even better probability success
17008	inspired tried solve bmyguests owls sunset find odd one similar group birds gathered prior hunt albeit evening hunt instead dawn foray however strigiformes gathered different group system different rules follow dont mess around showhowhoing outsiders away imposters torn shreds fed hawks payment staying owls hunting area sadly led increased security group two outsiders midst identify two owls behaving antisocially ie following parliament rules image rulea valid answer must contain parliament rule particular owls following puzzle solved blackandwhite printout imagenote column labels skipped letter purpose avoid confusion number cluenote bmyguest found valid pattern missed owls found fact odd birds since changed two bird eyes still outside intended pattern longer fall pattern bmyguest found delivered answer nonethelessthe one two hints added row owls simply liked pattern broke doesnt really matter many owls pattern holds positive natural number owls therefore must following pattern series possible eye pairs valid used picture
35440	first time poster puzzle rather shortaeioln kaolineolt joltaeilntr editone example help guide way hoped pattern answers may break goodcjk jack jockedit another example last one think word gamesaifr faqir
14960	john bob home construction decided take beer break grabbing seat john pulls planks wood nail hammer john makes bet bob saying ill bet beer cant make triangle given planks nail added rule must able pick without breaking ever didthe nail long enough attach planks wood together plank equal size shape nails hardware used attach planks together single nailbob given extra tools besides hammer hitting nail plankhow bob win betnote murder allowed john smart hid beers first
37491	often happens fairy tales king intractable problem one even wisest advisers could solve many years frustration exasperated king eventually declared could solve dilemma would earn favor join royal courtand often happens tales decrees eventually reached ears clever commoner named jack jack two brothers kevin strong ox nearly bright lewis simpleminded generous set odds found solution kings dilemmaunfortunately happens often tales king second thoughts promises crisis resolved mere commoners jack brothers would illsuit kings royal court thus schemed cheat brothers rewardhe claimed actually said people solved dilemma would come live castle necessarily nobility vein gathered nine people around castle nobility also commoners servants brothers choose three presented people take places castlethe king allows one question asked person present aware jacks sharp wit prevents asking questionskevin lewis query nine people much less bright brother fail ask useful questions receive lessthanhelpful statements belowandrew “ higher rank edward ” bernard “ ivan noble ” charlie “ andrew lower rank ” david “ charlie rank ” edward “ rank bernard ” frederick “ george servant ” george “ thats right im servant ” harold “ frederick told servant ” ivan “ harold commoner ” despite clever jack believes still best king elevate brothers nobility quickly deduces following facts people gathered himdespite disinclination actually grant promised reward king wants atleast appear fair thus must least three nobles amongstthe people presentednobles would fear lose position commoner butwould find amusement idea peers losing assuch would lie tell truth aboutanyone else castle including noblescommoners would nothing gain lose would jealousof countrymen elevated thus lie noblesto prevent jack picking otherwise tell truth aboutthemselves othersservants would grasp opportunity escape life ofservitude anything picked thus lie aboutthemselves anyone higher rank make theirposition sound better though tell truth otherservants present competitionnote rules subjective necessarily consistent ’ hard liars keep stories straight thusa noble asked rank servant would say yes ashe lies himselfthe noble asked servant rank would sayno tells truth servantsfrom three people nine presented jack choose brothers become nobilityclarifications moved commentsok sorry seem uncertainty expected none intended add complications confirm people inferred ranks castle go noble commoner servant intended ranks within ranks eg every noble rank every noble dont think matters fwiw jack brothers considered commoners statements made truth values even individuals presented thus x told true x could tell jack truth value second order statement intended whether x truly say modified whether speaker second order statement lies people xs rank intention create lie whole cloth x said lie x never said anything like spent minutes trying put intentions around clause clear language still pretty sure failed retrospect means avoided sentence type live learn guess intended syntax phrasing determining subject statement lieu looking grammar syntax etc sentence always first person mentioned eg better x sentence oneself true false based whether one lies x better sentence x even though refers ones self true false depending whether one lies people xs rankthis seems natural may standard even technically correct probably hell nonnative english speakers sorry
78451	worked masterpiece soooo long hope like itthe puzzle adventurous approached door b bragged brilliant bronze isnt even one c chinese classifier living chimpanzee detective diamond maze e stands excellent questions explanations f one finds nothing fishy g goes round round ground h hop illustration replace ilfavoured nails js done puzzle k kutie disguised quart l looks life layers pixels master managed find modest n nothing naughty applebeaten curious dog likes play optimal prime p plays periodic table poor professor q keeps quack away qi queer apples r renders riddles rations word stealthy show small art score finds trench thread u would unsatisfied lived unitone universe v virtuoso making veiled veiled clues w would vision two countries one x xpectrum xeen z knows well szyx greek well itz zeedisclaimer sorry advance feel anyway offended please feel free tell commentspartial answers welcomedcriteriathe accepted answer also provide links know mean missingsorryas mentioned garethmccaughan♦ specific rule list chose going follow rule would difficult puzzle makingtherefore easy hardenjoyedit theres threshold make lives easier loosely called rule limit leasthintsabout lazy go user list pse look one starting letter required try make riddle herd couldnt believe needs hint twisted deceitful diamondi n cute racoons steal stuff far awayt find hole thing hole itu pɪɛv voila hearv hint w lloverall dear senpais pse reflect life contributed psehere record progress
