77824	taken several flights emirates flydubai saudi airlines announced put mask helping others mask travelling family would like help first reason
102402	trying apply b b us visa official website unfortunately get past confirm photo stage see following error tried upload photo several times chrome android chrome ie avail something complete application
169987	medieval cuisine roughly th th century europe plethora dishes basically unknown modern palate frumenty pottage sops possets etc restaurants eat today primarily interested medieval european cuisine open answers elsewhere world honorary mention cardo culinaria jerusalem tried recreate authentic ancient roman dining experience abandon pretense authenticity years though persnickety customers insisting forks instead eating hand etc eventually closed sometime early update accepted best answer date still open since actual restaurant listed far quite fits bill
167938	toyota yaris small car loaded stuff need choose route based need refill gas frequently afraid heights drive mountain roads need safe accommodation rest areas road cellphone signal important care views
86021	related questions native english speaker two languages would give travel utility worldwide russian mentioned one sentence accepted answer language use georgia country english widely spoken widely spoken baltic countries russian ukrainian english andwhich languages brush ukraine trip thinking visiting ukraine deciding whether learn russian learn ukrainian already familiar cyrillic alphabet though recognise pronunciation bit different russian ukrainian compared mongolian one factor evaluating whether russian useful countries ukraine amongst countries reasonably touristy ie places locals raise eyebrow australian visiting country tourism assuming stay beaten track within countries knowing russian useful tourists already speak english wikivoyage phrasebook russian describes russian spoken summarize useful speak english promotional page lonely planet russian phrasebook mentions russia
5	another definition question interested easiest transportation use throughout romania foreigner plan visit point still relatively ignorant get particularly interested rural areas mountains difficulty crossing also ignorant
98306	current year ethiopia use something similar julian calendar could mean ethiopian born using calendar could present passport driver license form national id say usa show evidence even years old
77832	getting flight seems inefficient understand allowing first class first platinum class silverstar etc members loyal members allowing individuals meet criteria first seems fine since small group individuals total breakdown system first group whatever group may really bearing sit addition everyone clumps near counter everyone flight stowed luggage call next group leads people stuck jet bridge emergency jet bridge allow people travel back terminal would seem much worse compared people terminal airplane already question airports airline companies studies show method superior row assumption would filling plane back front would best method way delay passengers seated quickly everyone back putting bags away hinder others getting seat since people getting would always farther forward already boarded would prevent people clumping around terminal door
4105	traveling domestic flight us early recommended get airport flight scheduled leave international flights leaving us general rules times day days week airports tend busier would wise arrive earlier
10	recently wife traveled italy left got money travelers checks carried cash arrived one would take travelers checks many places accept credit cards eventually found currency exchange places would take travelers checks give us euro fee really fun surprise impression safer use travelers checks seems really accepted usual explanation fraud question best exchange currency home carry travel alternatives carrying cash safer cost effective
26635	wife planning travel japan next september brazil since child known made hole big one straight would reach japan well time passes every time look ground imagine far far away japan going japan would like know curiosity perhaps reach place travels exact point japan represents place could dig big hole directly house brazil would find japan tool online could help way easily find place using home coordinates
6158	new student uk attend classes london cambridge carry passport wherever go within uk college identity enough parents visiting soon ensure carry passports go somewhere london picnic
16	wife decided move across europe train know good sites planning trip via train schedule maybe prices going go across europe east russia baltic countries west france germany found one far oebb
8209	tonight leave sydney australia arrive early thursday morning event attending kicks friday plan sleep much flights good sleeping planes spend thursday sightseeing want outside least slightly active walking around looking things taking pictures since one anti jetlag strategies strenuous climbing things committing long hike need able bail time go nap unworkably tired perfect itinerary would involve buildings destinations look require hours worth walking certain amount standing around looking things going places spent hours huge museum fan normally unless super amazing choice day ditto movies restaurants sit eating two hour meal etc sydney week free time people spend day best things solo traveller would enjoy even entirely awake staying four points darling harbour think pretty good base walking tour plan right putting sunscreen heading door camera cash taxi back hotel tired
73747	driving spain islands lanzarote ibiza etc noticed locals tend drive around roundabouts outer lane always even going way around whereas england would tend take inside lane going half way around eg rd th exit way roundabout part highway code problem long know expect
65556	car rental company iceland charges extra two people driving car wondering would happen pay fee one person alternate person drive come know asking evade fee also need know emergency
26647	renting car told take state know shut car possible
143383	going taking trip germany days munich considering taking train somewhere austria innsbruck maybe could see alps wondering difficult travel countries something like need go whole customs process pretty much like traveling within germany since part eu
92185	happen go airport last day schengen visa get airport flight canceled go security immigration get gate flight canceled since gate immigration still schengen area would able go main terminal would happen exit stamp since unvalid
25	looking data plans use touring different countries within region without worry eaten roaming fees plans exist suppose mostly big telecommunication providers like vodafone mobile offer
18464	weeks ago berlin huge number excellent walking tours many free pay tip end covered usual sights well interesting less common things home oxford practically walk broad street without tripping group waiting one different mostly free walking tours start going rotterdam weekend hoping find something similar however able find evidence tours find details self guided ones ideally want find one someone leading group around offering commentary pointing interesting things answering questions etc tours exist rotterdam spoilt berlin oxford thinking common fact perhaps bit exception
149537	traveling around europe grew rely google maps gmaps public transport data new city need get b gmaps normally effective generating good route bus train metro tram recently though toulouse hardly case multiple occasions gmaps limited information able find much better options elsewhere asking people around local websites etc us seems example gmaps literally options going city center airport even though straightforward stops metro tram fine one expect perfect coverage variably sourced data everywhere hard time figuring prepare question knowing destination city ahead time best figure gmaps sufficient data area research alternative local apps maps perhaps whole premise wrong one never rely gmaps
34	tropical destinations one popular categories means always deals popping hard driven deals merely looking destination deals find tropical destination attributes desirable need help even knowing questions ask come mind hiking like nearby average wind speed like type beaches available surfing sunbathing secluded scenic water like clear calm strong swell covered seaweed etc water good swimming counter example took trip broome western australia found basically one swim time year due jellyfish stinger threats know questions ask destination best method finding good match
18467	according wikivoyage page bergen city center surrounded group mountains peaks known seven mountains read central mountains mount fløyen funicular railway well signed paths walking one fine seven mountains well signed walking paths situation like hiking munroe mountains scotland really need buy appropriate k hiking map
143396	planning visiting london two small children small children might need go toilet time time need go acceptable ask buisnesses kids use toilets even customers best way find toilets street good assumption would mostly stick touristy regions park acceptable small children pee pee trees parks
14374	currently planning trip new york looking website empire state building noticed following items listed permitted empire state building professional cameras equipment http www esbnyc com faq asp anyone tried take digital single lens reflex camera dslr problems security
6187	europe years wife year old son taking trip italy late november traveling venice florence rome flying venice rome however rome departure leaves first train airport believe agent told us check least hours flight puts us believe train takes minutes freaking little thinking stay night take cold showers etc yank wife son bed head train station ease worrying pain plan sound ok later flight cost
59437	company xmas trip every year trips organized ceo every year new place one knows destination happens pack thigns winter session summer session trying discover final destination based time leave airport work might change planes somewhere way would like know place check airline ticket boarding pass name think exists international place information least europe look likes would cia fbi information
47151	periodically buying something airport shop various european terminals asked produce boarding card scanned staff time every purchase seem logic e g type item bought total purchase value etc also seems never happen within restaurants bars shops random selection security process marketing initiative opt edit clarify instance experience personally flights internal eu related restricted products like cigarettes alcohol
71728	area people say need loo pee poo formal situations meeting strangers bit less open call need toilet know countries lot less open small children potty training age quite open soon learn local polite way say things frowned upon even mention words words acceptable likely clear area likely hard use brought culture heard words nr nr also could even understand well enough remember foreign tourist know use words would use home even polite translations english acceptable get asking ladies looking bit uneasy know still seen impolite societies past asked bathroom shown bedroom person asking understanding evation tell use situation acceptable location social class might needed get good picture keep going wide feel restrict english speaking countries would mind learning english equivalents people use language areas
36917	plan take external hard drives boston paris air travel safely transport beyond backing bubble wrapping taking cabin luggage else reduce likelihood damage mostly afraid screening machines flight vibrations
26677	years ago check would go airport directly counter always thought function check airline company would tell company airport going fly could useful know really going travel take extra verified information prepare airplane eg fuel per passenger maybe security know airport perimeter nowadays online check one month traveling depending airlines long time traveling empties bit assumptions check tell air line company procedure necessary avoided collecting extra information fill buying ticket online generate ticket home printing also done pay ticket one step
4152	understand one company actually north korea tours although lot tour agencies allow book wondering option enter via train instead plane especially considering north korean national airline low safety rating
2105	want really fly would take long probably would prohibitively expensive nevertheless really wondering already possible expensive companies might offer ventures
22587	know hotels built buildings used prison possible jail time tourist somewhere without crime short period experience added looking converted prisons spent quite time kinds langholmen favorite really interested experiencing real thing often hear people say like hotel days would nice see factual
2114	given problems israel several neighbours added problems several middle east countries due arab spring perhaps closed borders unsafe countries really want get israel europe without flying currently possible route would least dangerous least risk disallowed entry border crossings etc important part middle east end europe end really matter since travelling among european countries piece cake comparison
47173	parents visiting several european countries tourism purposes visiting following areas paris milan florence pisa rome venice innsbruck munich always like try new foods parents like eat anything indian food question easily indian food accessible areas places cheap country india normal lunch per person reasonably good restaurant costs around rs euros roughly
174149	noticed spanish people prefer manual transmissions automatics harder find opposite usa case rest eu spanish thing
26695	parents travelling us first time ever international travels layover schiphol want contact never personally transited schiphol know things work would options call would need buy calling card idea much would cost
73	areas avoided steps take protect radiation
184394	american male mid visiting germany first time winter staying week staying north rhine westphalia around cologne flying frankfurt much cold weather gear surplus germany austria temperatures forecasted visit planning wear surplus polizei parka understand green polizei style phased number years ago replaced navy blue jacket outmoded coloration lack polizei lettering exempt considered official clothes § stgb patch reading saarland justizverwaltung given pass use uniform fall afoul statute forbids unauthorized persons wearing official signs forbids official clothes polizei parka risky would better option surplus bundeswehr parka flecktarn camo pattern surplus austrian parka olive drab steinadler patch left shoulder america uncommon wear camouflage winter german people assume bundeswehr veteran wearing camouflage patch austrian parka cause people assume bundesheer read similar questioncan wear types military surplus clothing germany asking clarification specific articles clothing questionable official ness acceptable substitutes make first choice winter coat law
172106	ireland noticed bathroom light switch located outside room heard common european countries
22604	taking freeze sensitive items checked luggage short flight cheese chocolate toothpaste wine would like know whether luggage get frozen aircraft sometimes happened stuff actually quite cold flight like quite sure especially cheese really expensive freezing would likely demage usually pack everything well clothes time things many tough protect wine breaking details flight taking hours czech airlines paris cdg prague prg
34890	much cheaper rental cars returned place opposed elsewhere never understood booking car rentals want rent car rent location return location price significantly cheaper opposed car rented location returned location b find anything online would help understand car rental agencies sometimes waiting car explain coming another branch branch important car rentals go back place cheaper price
78	planning spend weeks israel palestine open seeing region apart gaza strip told region relatively small could feasibly stay tel aviv explore whole country wise cites would interesting safe use bases
77	someone recommend good website flight deals london uk could subscribe mean promotions different airlines e g bmi used bmifriday promotion sure still ongoing
94288	since implementation tsa security checks boarding plane u become major hassle time sink uncommon wait line hours take shoes belt getting scanned patted tsa agent waiting line however seen people appear non pilots airport employees simply walk gate flashing sort identification told certain security clearances allow bypass normal procedure altogether personally rather go extensive background check process every years deal tsa every single time fly somewhere work united states federal security clearance certain levels allow bypass normal airport security process note mostly concerned domestic flights u destinations rarely travel countries days
118865	staying san francisco weeks arrived gave european debit card hotel least thought withdrew dollars owed whole stay yesterday noticed debit card account went negative found hotel charged dollars nowhere asked going explained gave debit card first time authorized payment dollars system automatically took dollars cover costs today also said going take remaining dollars next days internet banking website see first transaction status blocked dollars one status completed end day dollars less supposed something like never happened know normal something called bank said money already hotel bank account hotel either cancel second transaction send wire money right way proceed update jul days transferred money card charged blocked sure dollars time asked reason said error system provided letter forward bank get transaction reverted transferred dollars cover remaining cost stay morning presented front desk checkout discovered block dollars money needed settle balance asked come back afternoon flight night said fix situation update jul afternoon said everything adjusted release side blocked amounts could leave obviously asked remaining dollars owed simply said okay days got back dollars accidentally blocked also charged dollars still owed charge happened without authorization guess simply assumed acceptable use authorization got first gave debit card asked bank money still blocked see system block automatically expire approximatively weeks guess means release anything actually apart dollars got letter think story ends curious ones denigrated used credit card asked around banks country credit card gave higher limit provided euro month obviously enough pay kind stay future
137298	planning trip usa soon germany like know much cash bring without problems clarify talking file form limit talking point authorities assume much cash must drug dealer confiscate money little hope ever seeing realize open ended question precise threshhold much depends authorities come contact someone give idea effective boundary edit yes expect well limit concern along lines credit card work want able continue vacation anyway still noise civil forfeiture usa concerned know going get precise threshhold get range hoping narrow bit question traveling money spending get although looking forward pastrami sandwiches cheesesteaks
85	tours new zealand based places lord rings films made
73825	one italian traditions yet fully understand aperitivo apericena basically pre dinner buffet comes included buy slightly higher priced drink around evening hours many bars best english language description could find sheds light great illustrative pictures matches observations great dinners little € including drink edit stumbled upon great description aperitivo lonely planet however still questions find whether specific bar offers aperitivo find places city offer aperitivi much expect pay drink aperitivo say ordering make sure actually get aperitivo deal italian english type drink order blend locals order kind drink get aperitivo type food expect aperitivo hours eat make bad impression take multiple servings someone stop scream italian difference aperitivo apericena avoid tourist traps related aperitivo else aware
100	heard unsafe show money help someone india rules respect order avoid getting trouble deal beggars
18537	girlfriend living apart months due work however sister wedding september uk going trying find flights meet somewhere continent america fly europe together terrified flying particularly water finding incredibly involved complicated process kind site help find flights stuck manually
105	help decide type transport use travel one us town another big journey without flying buses available suitable method traveling
24684	u citizen living russia multi entry student visa noticed migration card lists russian federation well republic belarus need get another visa want visit belarus already sufficient
2157	visiting us tourist visa look job us
110	traveling us europe weeks best method exchanging dollars euros imagine options like airport arrive europeat bank us leaveat bank europe upon arriving
39021	looking hard case light weight bag like one pictured however zipper top yellow line rather side would allow open bag without using lot space original layout anybody seen bag like somebody know buy something like
114800	going hiking trip norway need put tent somewhere put bag tent strapped hold bit like bottom issue bag native straps like may improvise flying norwegian airlines gatwick bergen
45166	generally possible apply visa another country country country origin concrete example clarify german passport travel without applying visa beforehand france spain morocco western sahara mauritania senegal gambia guinea bissau order enter guinea need apply visa possible senegal example also embassy responsible
57455	travelling rail russia dining cars present quality food would one expect train diner compared one would find europe especially keen know smoked fish lake baikal might available hot water drinking rd class coach
139379	hdfc forex plus multi currency card euro gbp złoty polish currency would use poland found suitable answer yet asking sure withdrawing cash good idea post trip update changed forex card regalia forex advantage upload us dollars swipe anywhere currency conversion charges see answer details
2164	last week october planning short city trip days europe recommend destination worth visit time year care degrees want get wet raining day particularly interested cities offer lot sightseeing partying important additionally countries prefer england scotland ireland spain balkans also possible travel switzerland without expensive
45173	travelling amsterdam new york stop reykjavik plan bring l backpack used europe found always buy carry bag within dimensions carry luggage specified airline wondering checking baggage draw suspicion regarding planning leave us tsa upon entering us
102518	situation encountered multiple times new york city streets lately usually sidewalk corner people likely wait pedestrian crossing walk signal gang two three four people present one hands cd plastic pocket supposedly pre release brand new rap album guy way wants take cd rather aggressive another man gang thing even asking name writing plastic pocket even give extra cds makes sense trouble comes start asking money talking donation begins seems difficult say guys want take cds back look physically good shape likely regular workouts gym appear impressive idea getting argument question process taking money wallet pay forced donation caught scheme accidentally let see bill wallet wanted right away gave minimal change friends one escape situation safely without giving money note duplicates situation even similar string scam used cities unique due approach someone looking friendly realistic expectation discover new music people rather difficult calculate first sight furthermore aware similar schemes different objects used living scam real
30836	would like go sicily visit main cultural natural sites rent car use available public transportation would prefer use public transportation difficult find information internet sites indicate buses reliable furthermore would summer would like buses early morning late night avoid highest temperatures would make vote car hand also heard driving sicilian cities could stressful taking public transport better meet people facts could help decide edit itineraryfirst week east coast including day catania one syracusa one etna one stromboli one cassagrande de cassabile one defined second week west coast agrigente way monreale palermo segeste zinguro
119	visited rome italy ended visiting august seems time italians fled city cooler areas nice less traffic able move around better time really quite hot fun definitely fan crowds would rather deal crowds bad weather less activities ideal times year visit france particularly paris balancing weather crowds locals tourists available activities festivals
131187	curiosity us citizen enter us embassy without serious reason example traveling tokyo want see looks like inside walk would assumed per embassy basis would need contact intentions would like visit plan go embassy hang something inappropriate genuinely curious interiors embassy
2173	two different bookings british airways emirates booking british airways washington iad london lhr dubaibooking emirates dubai hyderabadi hour stop dubai visa leave airport british airways says check bags emirates says problem since emirates ba partner airlines sure point flight tomorrow late apply visa actually done without problem two airlines difference single ticket booked travel website
