91124	travelling uk australia wanted visit number sites scientific history one top list isambard kingdom brunel understand surviving structures visit know visit ship bristol ss great britain visit museum display life works question museums sites england honouring isambard kingdom brunel
132086	years back traveled states valid esta attend one coding workshops bay area disclosed immigration officer border control let without problem workshop lasted less days according esta regulations could attended teaching lessons less hours week technically full time workshop got hours day actual lessons rest time spend students work projects together problem many years later found workshop issuing visas foreign students apparently requiring f visas attend workshop time discourage attend workshop esta ever since traveled states many times got issues estas without problems risks actually married us citizen plan moving back states years would potential implications situation green card application
113654	planning taking mid life vehicle miles long distance drive miles course couple days much experience car mechanics long distance driving rarely get highway take car mph kind stresses would drive press vehicle concerned anything e long distance driving harmful vehicle contingencies could prepare record vehicle hyundai elantra
33784	travel lot carry single carry laptop camera cellphone already external usb battery pack cellphone charge macbook nikon wondering possible buy external battery pack something like power adapter except also stores power usb outlets charge cellphone also ac outlets charge laptop legal carry battery carry heavy recommended products brands searched amazon could find thing found results microusb charge cellphones term search amazon
3065	sooo new dreamliner inaugural flight first flight tokyo hong kong bit competitive fun friend trying beat one another ride beat still one list routes open able time soon nothing like bit forward planning editthere pre orders plane roflcopter still missing found
25593	closer namibia zimbabwe separated less metres riverbed belonging botswana according wikipedia interested specifically case countries share land border separated short overland distance
125947	recently booked train tickets trip european cities online traveled train europe never bought tickets online search trains stations selecting specific train departure screen confirmation booking train city b train ic xxxxx departure hh mm arrival hh mm several trains managing tight schedule adding tickets cart checking making payment got email confirming bought intended passages chosen train times listed exactly website far expected next day received printed tickets mail one trains would taking except paper tickets time specified departure arrival city plus range validity dates makes doubt confirmed reservation seat trains reserved tickets printed generic way steps needed reserve seat particular train departure completed online must train station europe addendum based answers far seems much differences train systems unclear information needed disambiguate taking first tickets ic train brusels luxembourg city sncf logo upper corner ticket could indicate carrier unclear printed ticket seems overly generic worried enough ask question
1014	personal anecdotal experience found worse travelling east around globe also tend stay awake flight sleeping time tend matter flights london nz minimum hours shorter flights arrange around daylight hours reduce otherwise must better strategies help tiredness sleeping update fine despite nearly hours non sleep mongolia london next days stuff however second week awful sleepless nights erratic sleepiness theories also see prepare long haul flights
177149	searching flights nz back time feb apr next year using matrix find suitable dates prices however ran something thought odd prices round trip nzd higher two one way flights found suitable one way flights direction tried replicate flights round trip search flight date times flight numbers airline x one way back considerably cheaper per person flights round trip one way nz one way nz round trip total round trip price separate tickets vs round trip price combined tickets cheaper missing usually rt works cheaper thought considerable saving especially considering us traveling yes searches accounting travelers
5116	australia known fair share deadly insects animals would obviously concern say wilderness reason worried anything particular urban areas say commonly found deadly spiders
142335	railway still use uk legally permitted use railway velocipede dangerous even take railway hear train coming
25598	italian citizen possess driving license standard european format use identification purposes e boarding plane europe understand wikipedia exceptions general rule safe carry instead id card
25601	really like learn religions even though learning information internet would like learn real experience basically searching country composed people different religions religions better different sects religion also country small area e go several groups sects little time way determine religiously diverse city country
154623	travelling bangkok got know flying year old thai airways boeing safe fly plane old
168966	waiting gate security check fly san francisco europe gate agent asked go document check station manned united airlines employees station employee asked show covid test passport also permanent residence documents questionably also asked itinerary relationship travel companions pretty shocked airline employee allowed ask questions complained united airlines supervisor gate supervisor told tsa questions common united employees ask questions first time experience questioning many flights back us truly allowed common
89094	read timatic widely used many airlines check document requirements passengers fulfil board international flights demo link timatic web broken remember seen working able understand information provided passenger go timatic request somewhere web free see requirements beforehand
3080	ok anyone travelled beyond north america western europe know talking left romania last year right turkey last night start popping balkans course everywhere time get turkey become totally unavoidable matter patient long hold anywhere india japan asian toilets aka squat toilets know use one seems simple grippy bits sides hole middle wonder direction face let give try trousers like home squat like name says trousers seem blocking important thoroughfare hell supposed work way keep one balance position weight feet weight feet pesky trousers pretty sure locals remove trousers almost never hook floor often flooded exiting wet trouser cuffs socks wet toilet floor surely socially acceptable completely utterly sure wipe porcelain sit making believe west would dirty well say plenty trips plenty countries plenty oriental eastern asian toilets used unsatisfactory workarounds still want know one thing earth proper way use squat toilet
5137	travel around japan train make shorter stops nights stay would handy able drop bags station sightseeing checking hotel normal feature japanese train stations storage facilities automated manual much expect pay photo andrew stawarz
42005	travelling airlines based us large backpack prefer carry bag onto plane part hand baggage allowance foreign flag carriers however significantly restrictive hand baggage allowance caught guard one time new zealand airlines received backpack multiple broken straps clips managed repair still using pack would like avoid many broken parts future flying alitalia flight actually booked delta carried plastic wrap airport wrapped entire bag handing airline jpatokal recommends putting giant heavy duty garbage bag answer question pros cons using plastic wrap garbage bag anyone recommend effective techniques
140311	’ understanding japan ’ considered polite say “ itadakimasu ” eating ’ read seems meaning phrase derives buddhist shinto religious concepts however gives rise question would typical japanese person respond foreigner might christian muslim member similar monotheistic faith refused say politely possible cited religious reasons
60446	years ago invited friend place home cooked food contained alcohol eat drink anything contains alcohol religious reasons shy enough eat avoid embarrassments anyway planning plenty friends around world rude ask food contains pork alcohol even better invited mention earlier restaurant hotel since paying never issue mentioning mainly asking us invited westerners white christians specific think also work western countries
87070	travelling wales snowdonia england cotswolds year credit card amex know example eastern europe amex widely accepted uk problems using amex everyday use compared credit cards
177185	situation happened hopefully use answer future situations airport supposed fly wizz air tlv lgw https airportinfo live flight w hours announced would take gates away saw wizz air flight tlv ltn boarding leave https airportinfo live flight w wanted fly london book coach similar lgw check bags way ticket either airport would worked however want sleep bit new day arriving early would better point terminal passing passport control security would point asking wizz air worker charge boarding could get flight instead mine chance would agree let even small fee course assuming flight fully booked
48164	many pools belgium prohibit use swimming shorts citing hygienic concerns people concealing underwear beneath well safety concerns getting hooked protrusions like main alternative speedo like swimming briefs feel naked insecure biggest reason swimming pool decade back puberty since long ago since last public pool none swimwear fits anymore need buy new however want wear briefs mentioned feel uncomfortable checked websites http www artofmanliness com swim suit men mentions prevalent options trunks board shorts swim briefs right options give coverage would likely make feel less naked fact would prefer wear wetsuit wherever possible sure whether swimming pools even accept since might cite hygienic concerns swimming shorts wetsuits accepted belgian western european swimming pools look another option want clarify attracting attention concerned people assumed answers comments concerned running around small piece fabric covers little specifically speedo style pair briefs quite easily depantsable although much risk anymore mid twenties nearly depantsed teen trio teen girls crowded pool healthy nakedness insecurities
5157	road trips therefore always looking something special think special least parts germany highways speed limits since live close germany special looking country least partly speed limits roads would great europe least reached car central europe
56357	take depressingly long bus ride latin america wondering longest scheduled public bus ride world scheduled mean regularly operating connection start destination locations without switching buses besides fact longer seem operate would disqualify something like oz bus longest tending favour distance duration though either way circular repetitive journeys would obviously excluded edit august took bus lima rio de janeiro five days beginning end write
68646	aware scenarios common common anyone experience vary different border crossings much rather stamped visa additional space wasted like image http img click classifieds images hfcosv js qj hjmu k hq jpg
76842	km long road one main attractions thiruvannamalai tamil nadu india road goes way around small mountain called arunachala mountain considered holy road road pilgrims walk around mountain act worship whole road around mountain almost km considered sort holy site path like pilgrims walking around mountain millions pilgrims walking around mountain every year never seen wearing footwear kind paved road asphalt side pilgrims walk barefoot whole road around mountain considered holy similarly temple wearing footwear hindu temple considered serious offense want join pilgrims walk km road never walked distance barefoot hard concrete tiles asphalt received pilgrims locals someone walks type footwear road bad compared walking footwear temple latter totally unacceptable anyone tried walking long distance barefoot stone go guess pilgrims think go barefoot maybe get helpful advice go barefoot barefoot noob mitigate discomforts come heat stepping stuff hard stone base etc
9261	gone couple step transformers v → v course travels one purchased quite work advertised usually output voltage still much end frying one electronic devices instance trip shanghai last year traveling companion hair straightener plugged step converter actually similar model one menotalk suggested comments hair straightener overheated heating elements melted plastic housing pretty sight step transformers available travelers reliably convert v v without spikes words actually supposed bonus points compact design fits power strip adapters different plug styles
85039	seems neither new york general manhattan kind residential parking system mean tourist go park car manhattan free charge aware driving central nyc bad idea always nice get free parking possible
74805	flight arrives budapest next flight leaves day need hotel leave luggage sleep hours period usual hotels booked following day way book hotel without book two nights
27701	like trek mount fuji colleagues work tell takes hours pit stop stop rest go peak heard fairly easy require special skills done something similar want make sure get something stupid worried things earthquake activity safety climbing mountain general someone shed light go easiest way recommended resources tools require task
62520	guess happens quite frequently already checked security check realize backpack grandmother klingon bat leth blade item family generations absolutely want throw away possibilities point forbidden item fly want throw away airline company probably offer send stored luggage may inconvenient price item fragile large small possibilities option could shipping never seen courier post office airport never looked one actually well advertised unlike every store airport assume open times day airport operational possibilities
138297	planning take laptop usa adapter says input voltage v however cord connecting adapter plug mentions v laptop work along charger us cord issue connected us plug via adapter edit th feb let everyone know laptop worked perfectly fine adapter thank everyone responses necessary edits post
3129	gone take cash atm cash machine seattle visited half dozen end every single one wanted charge extra fee typically cash withdrawl non us card bank atms centre town branches rather supermarket somewhere end give let one charge needed cash unexpected rather annoying gone trouble getting card going charge lots use abroad instead hit fees owner cash machine really unlucky find atms wanted charge foreign user american atms banks trying find avoid hit fee
11323	last time entered usa border officer asked lot questions quite personal others destination usa example asked would stay knew address since private host asked know profession host answer question border officer seemed little bit surprised question questions able answer want enter usa
7236	flying experience passenger gotten used seeing letter airport codes akl auckland lhr london heathrow lgw london gatwick lax los angeles generally seem make sense sort logic flow applied name brings canada bemuses see canadian airports far seem start yvr vancouver yyz toronto yeg edmonton vr sort abbreviation vancouver guess edmonton least starts e explain toronto one comes idea anyone explain start historically
9284	travelling germany days need sim card soon arrive frankfurt airport take sim india international roaming activated option seems costly way get prepaid sim frankfurt preferably near airport make local calls well calls india
23622	tourist visa refused entry intended touring country pays return ticket would assume money kind happens
5192	one aspect british society known social class system apply foreigners london manchester week knowing neighbourhoods avoid visit seemingly bit complicated know overall cities safe areas known dodgier others could hostile foreigners outsiders hand higher end places bond street might want visit might appreciate attention outsiders know social class particularly complex topic want comprehensive explanation foreigners fit larger picture possible note visiting wife anglo canadian
5193	best way make ears pop landing plane hold nose pitch method painful methods pop ears
11341	came discussion recent incidents news often argued members public us guns requirement safety everyone right gun obviously talking citizens however tourist visits surely concerns arguably since know much locals anyway question asked trying avoid politics best possible non resident tourist buy gun travels around united states
109647	’ enjoyed flying smaller planes scheduled flights past e g aurigny ’ old trislanders scheduled flights europe small sub seat planes still running know westray papa westray flight already feel free include list
101459	interest know go airport check called departure gate board go flight number airline tells gate would check get boarding pass go security etc
113757	wondering road traveller must travel furthest meet sort civilization e g place could get food help fuel electricity etc googling mostly failed found candidates brazilian br australian canning stock routesaudi arabian highway km desert sure others would like make list top longest uninhabited dangerous hardest roads electric normal bicycle tour even precise solo small group bicycle tricycle expedition like tour without support following vehicles like dangerousroads org site could nice source unfortunately terrible read none search interface
7263	arab arabian looks september things changed dramatically arabs people similar looks indians pakistanis turkish kurdish iranians etc go west side world europe north america people keep giving look talking racism give example one flights new york los angeles hrs flight friend arabs onboard wide body aircraft around passengers whenever stood open overhead compartment grab something bag would look people people would stop eating reading smiling keep looking till done sure expecting take bomb something like one else stood opened compartment one would even care exact looks also found train paris amsterdam funny part arrive people gave looks would smile even would talk ask questions like thanking killing another time taking helicopter tour new york onboard two young american ladies kinda shocked see friend onboard literally making prayers looking us landed talking us even took pictures together another example would restaurants specially fancy ones malls museums another funny thing friend name osama funny kinds treatment name people sometime superficial treat someone suspicious way name funny always sometimes bothers lot specially one picked hundreds people random check police officer way deal sometimes totally weird treat like potential threat fun best way avoid
83042	inflight shopping magazine pocket seat front one reads crew come trolley merchandise nobody buys special offers broadcasted pa listened pretty cool like years ago really see point anymore onboard inflight shopping still thing
44130	place one leave luggage one day brussels either airport central station know lockers central station problem usually restricted h services brussels take luggage longer h
74855	use uber app heavily get taxis basically country uber also get local sim card sometimes always roaming turned problem receiving calls want drivers call considered international call might cancel played around app tried edit account info redirects website website grayed edit phone number note says contact customer service seems easy way change phone number tried another uber account well result practical easy way change phone number land new country get local sim change back leaving without contacting customer service
5224	airlines still allow smoking board international flights something banned across board everywhere fire hazard regulations e cigarettes
19561	recently visited vulcão dos capelinhos extension faial island azores erupted sea bed years ago visiting area gives great sense geological time scale although island quite fertile piece land really vegetation whatsoever would like visit places like youngest landmass came existence naturally visit interested man made land like palm tree dubai flevoland netherlands
95338	fiancée traveling various places ireland honeymoon mostly mid southern ireland dublin galway limerick etc reason learn basic phrases irish case english widely used language areas
83047	transiting madrid airport h min layover landing take enough go city center return much expectations visit know possible probably tight idea go iconic place probably puertas del sol square plaza mayor feel bit city maybe snack return weekday arriving around h
3180	current trip like previous europe crossed bosphorous asia proceeded east currently tbilisi georgia point like move even east ideally way across russia japan plus talk travel chat room got thinking east go asia would point one main islands japan smaller japanese island somewhere else totally failed think
103533	may various press reports eurostar would run direct trains london amsterdam end year example see london evening standard current status plans eurostar bookings open january search london amsterdam date try yields sorry trains coming back chosen date moment please try later recognise amsterdam destination though unlike dutch stations planned serviced eurostar latest status starting date direct eurostar trains london amsterdam
111726	hours trip airbus noticed seat available check time layout plane looks like took seat based natural idea provides extra legroom however searched internet e g seems precise information people mostly complain closeness kitchen slightly reduced width proper mention legroom anybody experience seat worth legroom also window seat enough frontal space stand get hallway without disturbing others
3183	big fan traveling extreme points like example northern point europe highest point country europe etc find new ideas would like know remote exclave island etc europe country also worldwide
9326	route home end trip hour connection guangzhou airport china read online unpleasant airport would bearable knew would free wi fi access electricity found couple sites saying free wi fi introduced end couple reviews mentioned wi fi chinese login english language link broken also mention might need phone local sim account something never heard anyone used need anything special log working english language option chinese speaker tell poor 鬼子 log chinese interface
5234	another shopping question think topic soon travel india first months spend south lower parts country warm hot like travel light plan bring light summer clothes later visit mountainous regions north would also like trekking himalayas nepal need warmer clothes boots sure buy normal warm clothes locally like quality outdoor clothes practical several reasons long term traveller little income buy outdoor stuff sale even second hand asian countries find special outdoor shops prices full retail prices west even higher usually high need buy fleece jacket hiking boots delhi wait north kathmandu place many backpackers trekkers prices like
85106	almost every train emergency brake wondering scenarios passenger would need pull emergency brake
35962	travelling iceland soon found garmin gps give directions iceland know plenty locations wifi vacation case driving around country want pay roaming costs internet abroad leads question android gps app lets download large maps offline advance use gps directions without internet connection
5243	going berlin weekend would like photograph tour bismarck structures underground bunkers industrial complex options
13437	suppose valid us schengen visasi savvy backpacker preference economical traveli fixed schedule meet longer travel time even better european port schengen country okay
3198	travelled bit point either dreamed asked visit every country world however straightforward goal aim heard much debate kosovo country according u n gibraltar country separate england scotland wales french guyana part france chris guillebeau one well known travellers country counters countries belt course travel realise becomes harder harder define country
3197	clear yes see everything google earth satellite imagery mean explore ge see forests canyons caves every mountain scaled every ocean depth mapped every jungle navigated basically question part planet left explore put foot rock shove flag ground name whatever please main areas left exploration someone might want try clearly every square foot sahara navigated bit harder say north american forest
21632	planning trip japan moment stumbling question transport read germany need translation driver license problem also apart major highways might difficult foreigners navigate japanese back country therefore wanted ask whether viable scratch plan altogether instead focus railways public transport go place place obstacle see plan would might skip interesting sights along way since make small detour along way wrong things putting much thought topic help facts base choice
