12766	different places world always feeling public transport airport really expensive actually get prices couple airport additional information able compare wanted create nice table find sydney domestic airport station aud one way using airport link km sydney central station car google maps sydney central ashfield seems distance costs aud km using trainsydney international airport station aud one way using airport link km sydney central station car google maps sydney central croydon seems distance costs aud km using trainmelbourne tullamarine airport aud one way return using skybus km melbourne southern cross station car google maps paris charles de gaulledepending transport eur rer eur roissybus km chatelet les halles car google maps paris orlydepending transport eur rer bus eur orlyval eur orlybus km chatelet les halles car google maps chatelet les halles villeneuve saint georges seems distance costs eur using rerlondon gatwick gbp using gatwick express bit cheaper using slower rail companies km london victoria car google maps price high something paid airport going included airport taxes flight ticket prices find even weirder makes cab taxi despite price increased cheaper train bus shuttle couple passengers also additional question price difference higher lower different part world
12771	would like travel usa period months want spend time working employer remote work getting paid employer possible tourist visa b b hope ok since getting paid us employer trade needing laptop connection internet money earn would actually help pay expenses get holiday
92643	home use double edged safety razor shave tsa let fly safety razors travel use mach razor problem open package mach razors use relatively infrequent travels mostly short business overnights longer vacation travel whole package oxidized dull time make second trip waste package looked individually packaged razors found cheap disposables bulk packs good way keep travel razors around without getting dull ever used
143846	travel lot constantly forget various small items places go instance recently left travel adapter starbucks months ago forgot many toiletries airbnb heuristics avoid compartmentalize items bag seems work fine important things e g never lost passport nevertheless enough
4582	decided country want visit next go local travel book store shelves ten different travel guide books country choose among tricks find good
133609	canadian citizen travelling europe first time worried difference voltage two regions currently plan bring travel adapter voltage converter power strip bought recently power strip marketed something without surge protection time overcharge protection overvoltage protection well confused power rating states v planning use v potential hazard would power strip adapter combination alright europe sorry bad physics knowledge thank much advance specifications power strip power rating w v usb power rating w v usb port input ac v hz power strip question found https www amazon ca gp product b zcg jr ref ppx yo dt b asin title ie utf th
74217	already gone question empty suitcases however address protecting suitcases possible damage friend foreign student studying germany would like take empty large suitcases india bring back filled returns however feels suitcases might get damaged checks empty travelling germany know airlines usually problem taking empty suitcases would like know methods protecting suitcases empty suitcases placed one inside good idea wrap airport something along lines protect empty close empty suitcases damage
2539	summer spent time moscow st petersburg also visited friend family custom drink lot vodka meal guests also drink vodka obviously enough russian friends difficult us convince would unwise us drink vodka think fact slightly offended invited meal hosts avoid drinking lot vodka without offending think difficult drink could say drink religious medical reasons excuse could use already started drinking want stop
14827	southwestern united states many interesting spots reachable via road trails rental car contracts seem always include clause disallows driving roads even renting suv visit areas risk ignore clause drive trails
119277	get identity photo eg passports kinds official documents foreign visas uk france instance photomaton group booths nearly every city mostly train stations airports famously amélie movie uk group http www photo co uk entire london area far city centre wonder people get kind pictures uk note googling uk printed identity photo something similar leads several websites proposing print photos real challenge taking first place given number constraints kinds photos unreasonable expect people take using smartphones point shoot cameras need control lighting background distance etc main advantage using photobooth
147946	travel us uk meeting relating work meeting go well shall return uk soon meeting fix thing working goes well shall take extended holiday meeting possibly weeks possibly us possibly travelling afield brother us likely spend time shall return ticket use return segment extend trip arrive us expect asked long staying us passport control would easy say duration meeting could explain situation uncertainty involved length trip seems like would wave red flags extended stay uncertainty longer away work usual especially us worried go detail cause problems however lying immigration officials could cause worse problems dishonesty identified honesty best policy situation tell easy story may well turn true may interested minimising chance trouble especially trouble interfere ability travel us
117230	issuewhen flying carry allowed often bothered allowed carry small knife need destination backpacking trips far every time faced issue bought knife destination offered someone flying back home generally cheaper pay extra checked luggage would put nothing knife could also mail knife leads problems e g address mail wondering whether could ask customers checking luggage flight could put knife checked luggage afraid customers would find offensive ask afraid would put delicate situation generally recommended accept solicitation tell whether somehow hid illegal substance knife also afraid security personnel would target next time experience situation flight vancouver bc san diego california questioncan get trouble asking people agree put knife checked luggage answer could sure give try got nothing lose polite frustrated work going get serious trouble airport security maybe even people helping could get trouble sadly expecting answer closer second option
497	sources seem differ precautions required authoritative source check better drug anyway
66034	air france cabin crew angered ruling wear headscarves tehran stated air france women even people presumably non iranian non muslim required wear veil iranian law requires veil covering hair worn public places women territory airline said wikivoyage says hijabs recommended areas headscarves required law presumably recommendation tehran several bigger cities western clothing formality accepted wearing hijab may required rural areas women law must wear headscarf public women iran legally required wear hijab merely required wear sort headscarf latter called part woman cover read difference hijab niqab burka seem help related question appropriate attire women muslim countries answer mentions iran
2550	read places gmail com sometimes blocked workaround access email china
23031	going travel soon need maximize weight content taking checked luggage minimize weight bag suitcase tips thinking taking cardboard box really light cheap also disposable destination need leave behind sure one take card box strong enough consistent resist trip seen luggage handled would appreciate comments ideas sugestions note write suitcase mean kind bag container
25081	us vietnamese embassy website lists requirements visa application list fee though say pay information page fee fee stamping visa checked consular feewhat current fee tourist visa vietnam
4602	days flying amsterdam spend fun weekend repeatedly mentioned previous questions nevertheless little bit sightseeing also necessary know lot amsterdam looking forward typical sightseeing suggestions far one point list anne frank huis
14845	read somewhere trains going antofagasta chile la paz bolivia would go calama information date respectable alternative bus ride buses chile companies like pullman tur bus pretty luxurious train comparable
139775	traveling didcot week taking train london arriving didcot late night around pm want go harwell campus public transport available harwell pm earliest able get taxi cab didcot parkway station checked uber always showing cabs available given places found taxi services line pre book sure authenticity whether work late night
123392	days ago settled uk noticed hot tap water specific heathrow airport option toilets e g restaurants tooooo hot water touch hot water even one second otherwise painful wash hands hot water option
45569	husband academic contest prize trip netherlands global conference specialty responsible paying food transportation lodging flights booked college options spending money get cash states international exchange rate commercial bank use american credit card visa international exchange rates credit union use atm found fee information yet decide much cash carry types things likely need cash note since answers concerned magnetic stripe versus chip pin credit union process switching chip pin able call get new version card leaves
516	malaysia three times penang twice kuala lumpur mostly used taxis get around found drivers always wanted negotiate fare front much higher meter fare sometimes could argue using meter times heading back kl zoo simply take unless agreed flat rate first thought scamming tourist heard though law sets meter rates low drivers make living going meter simply worth time way verifying though gut reaction someone tries running scam case thailand living time thinking penang next year anyone experience situation verify cause trustworthy drivers kl penang negotiating honest fare provided let seem like easy mark edit clarify really problem paying drivers something live want overpay get swindled
2565	talking another traveller particularly grumpy munich airport free wifi recently seem recall germany pretty strict laws prohibiting open wifi access person providing wifi would responsibility somebody hacking signal know whether law prohibits kinds free wifi kind user need password key enter kind info page comes first allowing access net could exclusivity deal restaurant cafe paid airport rights wifi provider thing munich airport lacks free wifi german airports lack free wifi due law outlined
133636	unfortunately aware boeing max receiving bad press two fatal plane crashes five months china suspends commercial operations boeing planesat time writing max ’ grounded indeed couple hours ago ethiopian airlines insisted would continue fly aircraft since revised position recourse passenger scheduled fly commercial model plane refuse board safety concerns airlines handle issues airline specific ticket contract exists general global aviation rules cover well founded fears catastrophe well found·ed adjective especially suspicion belief based good evidence reasons tl drmethinks well run airline like ethiopian airlines major country like china deciding ground aircraft based two catastrophic events short period time fits textbook definition well founded catastrophic plane crashes dime dozen updateglobal civil aviation authorities banned flights using aircraft everywhere issue fear well founded dead water kaput
14853	seen many etiquette questions japan seem find reason know countries like taiwan china seem issue would like know difference also also apply public places moving around
98827	whenever shop airports abroad always get asked choose currency options paying via credit card one local currency another one currency country card issued india inr case two options benefits choosing one
90636	driving los angeles bay area wonderful straight road cars sight whatever reason matter briefly speeding around mph km h pulled officer interstate road facts driving rental car copy driving license europe credit card uk resident first time usa california driving license residency statushow happened given citation requiring mandatory appearance officer said await letter would arrive within days week leave country received letter called court period expired scheduled date days flight backthe day came went local court read online would reality hours away able make next available hearing day leave country called asking suggested write letter judge asking remove mandatory appearance sent fedex delivered next friday know read action left country friend mine address stayed forwarded letter containing text failed settle case continued failure comply result driver license suspension increased bail amount civil assessment unpaid balance referred franchise tax board collection appearance court mandatory clear citation must appear traffic division counter fridays p anything trying contact think way talk judge directly video conference someone authority resolve
76299	curious everybody coming u must fill customs declaration e u make declaration walking either nothing declare things declare sometimes separate lane intra e u travelers seems like would much easier get away smuggling things e u u often e u never see anyone contrary u pulled times random inspection e u catch someone one edit also note know declare given form everyone access internet although becoming less less problem
109071	mom traveling new york city together soon years old time travel airport arrival newark liberty airport ewr go one border control officer together since still
168465	general traveling hotels around night especially larger cities places like japan singapore pod hotels meant single travelers budget equivalent western nations like usa even larger cities like nyc closest could find hostels definitely seem cheaper standard hotel room worried much privacy also seen hotel rooms slightly reduced space seem expensive standard hotel room alternatives may aware
35348	follows travel conversation group us hostel london assuming travelling randomly countries continents two languages addition english would provide usefulness given country suspect spanish north america south america french europe africa base understanding french spanish maybe time would best spent learning another language question real puzzler since following constraints applylength time required functional language cost time trade chance reaching proficiency within meaningful timeframe mandarin regional dialects destroying proficiency arabic easier secondary languages underpinning society arabic versus french argument similarity language families romance leading wasted effort italian v french utility language german versus english english understood enjoyment minor considerationhappy consider thoughts really interesting topic consideration linguistically minded
113173	love london like holiday every year lately keep hearing knife crime london clearly rise year old child us would like request advice reduce chances becoming victim ordeal news articles anything go becoming little scary think going right every time personally never witnessed crime thankfully another couple nothing specific us make us target criminals walking around streets using public transport wife wear jewelry carry expensive bags interest prying criminals walk around holding iphones hands next busy road avoid congested places travel tube rush hour tend live around south kensington obviously tourists roam around city deterred media coverage care child well try make trip safer one death since question asked less hours ago people busy voting poor question ask
39446	planning travel portugal attend academic conference regard needed short stay schengen visa visa application field purpose travel following options business sports cultural study visiting family friends medical reasons official visit transit airport transit tourismi attending conference present research conducting part phd study closest opinion want embassy misconstrue studying university portugal case would business right option choose
35351	way leave hkia foot hour stopover would like shortly visit neighbouring city tung chung home year old forts temples want avoid hassle withdrawing hong kong dollars needed go bus also like challenge leaving airports foot without using money
53782	qualified first aider uk would automatically stop give aid accidents emergencies saw watching us show tv night someone arrested giving first aid licensed correctly questions correct anything accident scene guidance acceptable tend travel us canada mainly asking advice would interested countries well
49691	like know things want know possible options buy train tickets indonesia assuming buy different places advantages using one option another
2589	montezuma revenge aztec two step central america mummy tummy cairo two step egypt kurtz hurtz uzbekistan bombay belly delhi belly india case sh hershey squirts mcsh north america butt chunder australia karachi crouch pakistan suryavarman revenge cambodia kabulitis afghanistan holiday tummy united kingdom bali belly bali taghazout tummy taghazout kathmandu quickstep nepal beaver fever canada thailand thai dal wave peacekeepers arabic speaking countries called yalla yalla arabic fast fast central asia ridiculous every second backpacker walking around toilet paper regularly make run egypt half tour group got sick time converted mobile pharmacy regardless called best way try prevent
8738	reading question questions popped head know stateless person read wikipedia page could find stateless people travel stateless people nationality logically passport passport stateless people travel
51763	assume buying flight tickets online another country enter passport details make things complicated current nationality need visa country buy tickets journey acquire another nationality whose passport allows visa free travel country since believe changing passport information non refundable tickets generally costly operation carry passports traveling get away airline claim since entered passport information requires visa order visit country board plane without showing visa border control country question care flight tickets long show new passport fine believe airline might pose discomfort ideas experiences
76348	grandparents acknowledge technology ability distort exaggerate pictures yet still feel hoodwinked second rate reality compared first rate images improve e g expected picture parc national des grands jardins québecbut tolerated grotto indian head cove bruce peninsula national parkbut tolerated cap bon ami parc forillon cap gaspé québec tolerated
84540	trains liechtenstein international fact serve least three countries countries regular passenger train services trains international
37439	airlines usually either allow transferring tickets another person purchased extremely inflated price reason one idea came would allow authorities background checks one could buy ticket airport shortly flight course would expensive would risk fully booked plane impossible
16960	wife arriving london via heathrow airport lhr staying hotel near king cross station wondering best means fastest also easiest carrying two large pieces luggage two carry ons way get lhr king cross gather one changeover take tube however interest passengers thought would best take taxi maybe bus thoughts
43593	us probably canada well possible pay gas station either credit card often fee us cash pay cash gas stations often require prepay gas however always wonder much prepay suppose people owning car know much filling tank worth car sometimes rent car visit us car different fuel consumption usually estimate much km worth terms fuel prepay close estimated amount works expected behaviour supposed fill tank entirely every time prepay large amount ask difference prepaid filled could pay way larger amount know oil price low prepaying usd might seen way much question might sound bit weird obvious every time rent car wondering etiquette
12873	planning trip asia back rio thing traveling flexible dates thinking buying one way ticket hong kong planning want come back noticed example one way ticket melbourne rio costs less dollars month may search round trip melbourne rio back find flights know using return melbourne still prefer save issue buying round trip return never use
82508	travelling las vegas work want spend extra days expense surprised cost hotels las vegas strip suppose subsidised gamblers spending time hotel casino however big gambler although probably gamble something would far norm general commitment gamble expectation people
86605	aware form sign ground staff airport want let board aircraft due ignorance regarding destination entry case transit requirements way carrier liability waived get destination form called words exactly ask likely going ask tbilisi airport taking flight doha days transit london hold id card accepted uk destination expect get easy time boarding tbilisi doha flight even though entering qatar timatic explicitly state transit qatar id state opposite hence form would great help read blog author trouble boarding flight minsk transit portuguese id card writes wrote haiku style poems phone airline man came sheet sign ‘ ’ make responsible coming back case ’ allow stay minsk enter georgia ’
2643	planning go europe nov dec since come tropical country really idea wear winter checked temperature date last year based http weather uk msn com monthly averages aspx london celcius farenheit amsterdam celcius farenheit munich celcius farenheit lucerne celcius farenheit france celcius farenheit need wear kind temperature one question jacket enough put layer http www google store com product info php products id
90708	airplanes tell put bags either overhead seat front considering front row seat front back seats anything would efficient people put backs underneath seats please give answer legroom know airlines care legroom
21077	based question passports expire possible function serve limit validity time
180822	live us traveling japan days want know need adapter usb wall bricks none three pronged two prongs appliances like lawn mower toaster talking things carry charge cell phone laptop watch etc checked reddit faq power plugs website getting confusing information would imagine frequency voltage difference matter long prong fits guess usb bricks would stabilization mechanism built right edit japan gadgets blown caught fire even though still using power bricks us
72275	brazilians oktoberfest wife made dress brazil trying something close dirndl dress entire party people looked lot dress surprise eyes like omg looks dressing sometime asked smiling took photos question dress code mean
6746	occasions years ago trans atlantic flights made unscheduled fuel stops ny europe geneva iirc stopped shannon ireland europe brussels iirc ny stopped bangor maine occasions announced would disembarking allowed stop always wondered would load plane enough fuel first place make destination airline pay lot landing fees would want avoid unscheduled stop always wondered perhaps something else going besides needing fuel anyone knowledge
162396	would love someday go india travel bit wondering exactly deal street food wisdom street food trust told really want get sick india pretty sure lot street food beyond delicious probably cheapest way eat india gauge safety indian street food
68194	basically question one asia oceania travel decided upon destination decided whether learn language however currently wondering languages useful multiple destinations suspicion asia fewer languages useful multiple countries compared africa americas criteria number countries involved rather population country yes even countries buy ebay distinctness countries languages spill bit neighbouring countries mongolia spoken neighbouring bits russia china ideally looking languages spoken countries border similar culture ideally relatively easy tourist level communication language difficulties wanting fluent learning keigo japanese whereas languages tonal problem affect wanting beginner level speaking languages likely taught australia preferable interested countries close australia suitable tourism anything east middle east part americas considered asia oceania languages think english chinese china hong kong macau taiwan russian russia stans plus areas outside scope question korean south korea sure north korea think one two countries speak french spanish portuguese huge number wikivoyage guide asia mainly talks indigenous languages rather ones actually used oceania talk section
610	many street tea coffee sellers around india although water boiled point often pots long time clay cups also lying around dust safe drink image courtesy proxy indian
12899	planning going long distance bike tour want good website blog post photos twitter tweets videos anyone advice whether build pay someone else worth keep personal journal feel like would cool communicate online lot blogs online stuff seems pointless add another
4712	arriving sydney friday week ideally like pre pay simcard text data need check stackexchange sites course however idea companies options exist would best traveller terms moderate data usage also possible buy airport arrival
25193	doctor board heard announcement flying specially long distance talk american medical doctor non american carrier told tries travel non american carriers much possible simply carrier country legislation place flight way liable discussion made wonder factual mean longer medical doctor board airplane another country doctor also apply traveling foreign country
