35867	friend great vocabulary also quote humbleevery time play scrabble wins easily says tries best one exceptionif opportunity ever arose would never play highest possible scoring move game scrabble thinks would showing offif multiple scrabble moves maximum possible score would consider tied st willing play next highestusing standard scrabble rules standard dictionary would highest scoring play friend would wiling make gamecount letters values highest scoring word alsoall secondary words created turnall maximum possible bonuses based location words earning scoreedit although believe problem solved basic assumptions made regarding need use certain bonus squares thereby severely restricting number possible primary scoring words played made question open ended case room improvement
31772	last summer spent week holiday hotel small resort town close sea room next mine stayed family parents two children elementary school age looked bit stressed especially parents otherwise perfectly normal noticably different guesthowever soon noticed something odd familyevery morning would leave room th floor take lift lobby ground floor breakfast finished eating would take lift back th floor prepare day full whatever family summer holidayevery evening however would take lift lobby eat afterwards take stairs back room struck weird lifts perfect working order used within minutes disappearing staircase order get back room one day walked lift arrived door four sweating breathing heavily looking like much rather taken elevator climb ten flights stairsi dare ask insisted strange evening ritual thinking silence room answer became clearso reason neighbours behaviour
60448	congratulations achieving final stage millionaire super logic showonce name athin ill host help win jackpot one million dollars audience cheering clappingall pick single door doors labeled integer exactly one jackpot rests minor prizes ranging help listen carefully assistants mine give statement hint cautious exactly x people lying x written piece paper inside pocket share way know sure jackpot know value xaww dont sad im cheating part game hahaso please welcome assistants audience clappingok ready minutes assistants tell statements hopefully win jackpot tonightmy assistants game starts audience cheering clapping assistant jackpots door even number jackpots door square number assistant jackpots door square number jackpots door number less distinct divisors assistant jackpots door number less distinct divisors jackpots door inclusive assistant jackpots door inclusive jackpots door even number assistant previous statements statement exactly person false assistant previous statements statements exactly people false assistant previous statements statements exactly people false assistant previous statements statements exactly people falsethe time starts ticking think like brilliant millionaire door leads jackpot
46113	nice riddle friend nathan made useless alone deadly numbers heart connection friends root modern society though indivisibly small operate second brain humanitys hive mind ihint think indivisibly smallhint really mean deadly numbersif choose downvote please comment reason may improvefix problem
111652	two spiders trying catch ant constrained move along edges transparent cube speed ant speeds spiders v v respectively whats minimum value vv spiders catch ant starting positions whats minimum value vvv therere three spiders
44070	one morning man woke received important mail giving chance go one biggest server rooms world even though may seem much experience individual dreamed network administrator whole life could jump start career admiring one many people could go experience remembered email said chance go certain email said could experience life time answer question else another individual chosen question first thing notice walk server roomwhile man wants make network administrating future career young never walked server room ever life time could help answer riddle fulfill mans dreamhint think literalhint common problem computershint would notice imediately got roombig hintonly use read hints clueless would strike one senses unfavorable waytwo people finished time wish mark correct gave win gave closest answer first sorry didnt win
44074	image could replace blank tilehints neighbours important overlapping lines two timebig one criss crossing lines overlapping pair images
27692	call something physical something touchbut technically correct dont weight muchin fact weight zero im matter allyet cause damage inflicting material fall creation involved upon time featherbut im said spawn curiosity weatherim opposed animal spread like diseaseif im plenty youll nag im scarce youll feel uneasesome people havent yet seen others see daysometimes im kept securely sometimes thrown awaywhat ieditapparently question caused lot headache community theres natural suspicion might poorly formulated understand promise ive taken lot consideration make sure isnt please view question mine verificationnevertheless ill collect pointers comments improve solving experience hope helps community reopen itfeather refers old style writing equipmentcuriosity weather refers bejamin franklins interest electricityfeather vs curiosity weather need viewed together polarityanimal actual real species existing today commonly spread areas worldopposed animal refers term used describe opposite subject would looking recession ie bear market opposite animal would bull remember subject described without animal epithet original version howeverspreading like disease refers rapid rate spread also way rather nature spreadnagging vs uneasy refers different qualities subjects appreciated ones welcome arent possible displeased excessive number simultaneously happy wantedpeople hasnt seen real people living today although unlikely find individuals fact contemporary world remote tribes extremely secluded communities special cases gravely handicapped mentally challenged infants elders may aware subjectkeeping secure refers nature spread period storagethrowing away refers disposing unwanted already consumed subjectswhat average id say common concept used daily basing spoken frequently relied since many years described single word less five without disclosing exact number
37932	today received email friendhi bobi managed get concert tickets wanted badly ticket firstattachment however since took quite get im going giveyou ticket protected character password use secondattachment figure password good luck johnthe concert days really want go help figure password characters second attachment text file looks like gibberish maybe figure means tito another idea zero kelvin yields dreadful audio random system transform epsilon juxtaposition hiv treatment xii lukewarm overflow nonconform dynamic overview vanilla roentgenographic telegram desk sushi dish calamari new venogram nov anna layton extra kiwi ask lemon cream extraction mastership anyhowhintsince theres much time left john gave hint today said use whats text file find nothinttoday asked another hint told want another hint already give space like relationship something apparently space important himhintjohn gave new hint words wont tell anything try reading lines hmmm lines also dont mind punctuation dont need ithinta new hint heard research showing order letters word doesnt matter long last first letter correct fascinating
50220	inspired increase word ladders lately found fun onetransform color blue pink proper names steps easiest
62511	three bicycle locks ones like thisbecause look much alike etched unique number lock number keys unlock unfortunately seem lost spare keys also corresponding numbers etched themyou tell one spare keys dont want tell one course dont believe youhow convince one spare keys without letting get information whatsoever one havei still keys locks willing cooperatedisclaimer puzzle inspired stackexchange answer httpscryptostackexchangecomquestionshowdoiexplainzeroknowledgeprooftoyouryearoldcousincorrect solutions problem given however hoping someone would come solution involve props like tall trees polesif someone comes solution like would find elegant reasonable time span accept answer otherwise green checkmark go keelhaulpicture taken httpscommonswikimediaorgwikifilebikecordlockdjpg
56369	mrs jones celebrating rd prime number birthday years collected gold coins number coins prime number less decides give coins three children amy oldest jack middle one lisa youngest first gives coins individual age numbers turns ages different consecutive prime numbers remaining coins gives number month born turns born exact month also prime numberof remaining coins gives number day born turns one born prime number day amy born x th day th month z years old get xyz coins mrs jones coins left total number coins kid gets also prime number kids end different number coinslisa teenager ends getting coinshow many coins mrs jones many kid gettwo solutions possible
17458	lighter feather held person minutes person touch human life based ithint fast run normal dont runso answer
74802	knowledge required riddle englishlanguage proverbsmy friend leonard came problem day said “ tanner want cleanshaven face every time use razor end nasty painful rash ” “ razor burn ” said “ yeah thats right ” said leonard “ advice ” “ unfortunately theres good solution ” told “ youre going either grow beard cope painful rashes ” leonard grow beard
31796	special positive integer numbers need find questionwhat minimum value biggest number numbers provides sums two numbers among including numbers chosen like different otherfor examples let say question asked special positive integer numbers result would would answer since would different
78903	youre mansion power main entrance blocked mansion doors coloured blue green red enter red one time leaves another three doors colours enter green one leads another doors colours enter blue one doors sign sign says ‘ survive make right door leave ’ first door says “ open poison gas come ” second door says “ open sit electric chair pull switch ” third door says “ dangerous spiders come enter ” fourth door says “ whole building explode open ” last door says “ open unlimited amount water come drown ” door choose choose hint read top bottom
70712	find way make concatenation andor adding mathematical operators×÷standard parentheses add numbers equation reorder existing numbersthe result must mathematical equalityharder versiontry altering left hand sideinspired make hopefully somewhat challenging previous attempt may hard
11321	five logicians seated around table blindfolded hats placed heads removing blindfolds told true statementeach either one hat two hats head totalnumber hats actual number told themthey told answer question many hats head clockwise fashion starting possible logically deduce number hats heads otherwise reply dont know wait question cycles back themthey means knowing number hats heads except logically see every person means communication tricks involvedthe game completes everyone figured hat count number onehatted logician placed thatthe game completedthe game goes forevernotei made small error posting question since people anyway upvoted answered one ive left posted actual question second version click view
80956	quantity always see facepalm oh seen combs sometimes balls goal hi far callsif mmm id finnish wirei may small yet entirealpha one number eternity methe first learn first seeupright lying differs countrynonetheless im still worthyben ten sees mostand im perfect thats id boastfather son holy ghostthis valued utmostfaith hope love remainwhat value obtaindeviously new weirdly toldyet messily since oldafter match youve wonand guessings donefive times four five alltogether give allthe last keep hiddensenpais riddle writtenhints bits bits shall unfold next told stanza cipherwordplaylanguage stanza wordplayvisualtagaepilogue dont read want solve riddle since changed profile pic solves hint posting profile pic
35902	man decided place flowers three different temples magical pond temple swim one trip pond temple pond temple pond temple fact magical ponds anyone swims across pond flowers number flowers doubledhe buys flowers goes trip three templesat end trip flowers remaining placed equal number flowers three templeshow many flowers buy many place temple
99392	odd numberwhen take away twoi become even iedit hexomino got original answer come another valid answeredit quantumtwinkie got answer really cool see many creative solutions
3136	found question became curious anyone tell answer prove know seems fairly simple thought explanation would make interesting caseflip fair coin repeatedly get two heads row hh assuming h indicates head indicates tails average many flips take flip get heads followed tails ht answers
9282	young man walks forest comes bridge front bridge large man carrying axe man says want cross bridge must tell something think statement true strangle death think statement false chop heada minutes later young man walks bridge larger man stands pondering say
31811	niece gave word wheels challenges day comes alternative heres challenge works find word form another word moving first letter end word vice versaexample emit mite item longer form another word heres rule must word found dictionary common name must least letters longmust least rotationplural form end counts rotation form another word afterwardplease dont like niece use example answerscoring point letter used emit points point rotation emit rotations thus points point word loop infinitely highest score winsthis challenge remains open least days times uphighest scoredr xorile engineer toast base time answer submitted dr xorile winner challenge creative answers like much thanks everyones participation
50243	twist wordladder type puzzlereach bottom top following rules step change letter remove letter add letter move changed letter change place word example want change second e word change move r word make word letters word change order unless reverse order example order changed redo one step removing second letter reversing order others however change rodeo one step would require changing order letters smallest ladder accepted answerps avoid controversial issues regarding whether something word word word must appear uncensored mammoth word list litscapeneither mott moto appear list proper names allowed
48200	griddeduction puzzle whose mechanics seen several names castle wall one ill use herethe goal castle wall draw loop enclosing numbers grid number represents many cells see orthogonally including example puzzle solution clarify worksbelow actual challenge answer four letter word quite thematic entire solving process puzzlepsa anyone already made progress row column edited clear ambiguity sorry errorfinal psa row column edited yet truly bit doofus cleared ambiguity wrong way definitely correct super super sorry silly mistakepsa sorry folks another edit know careless thankfully edit doesnt affect anything youve done far red symbol changed row column
60490	rebus fine also riddle must sign spoken seen little
64587	solve five give final answeryard lumber famous way lies idyllic children suspected killing relative though may unintentional fugly steps bulbous feet cant steal princes heart abhorrent thing bribes hottie eventually becomes homogeneous molecular mixture ie cup tea redheaded formerly girl determined fun sleeps around hairy ones house answer suspected many believe killed stranger death relative exact time purely coincidental
17486	jeremy store owner uses combination locks like one store locations secure cabinets semiimportant documents combination made numbers inclusivelyover years built stores jeremy developed system remembering combination store location secret associates trip combinationhere couple examplesfor original store trip remembers belgium germany france combination second store trip remembers saudi arabia iran qatar combination work jeremys new location cabinet combination locks always looking people excellent problemsolving skills promote top managerial positions within company mind told trips associates lock knowing motivation would love able figure combinations get much better jobthe trip lock brazil chile argentinathe trip lock everywhere nowhere homethe numbers correspond areas traveled order area traveled one one number associated process super complicated doesnt require arithmetic mod doesnt require knowledge provinces states zones regions response orens comment countries many areas except unimportant detail turned valid numbertip ignore lock first figured method apply lock apply small amount practicalcreativelateral thinking calculation locks get lock edit extra info jeremy horrible spelling great remembering short nicknames abbreviations likewhat combinations
97362	google find reflected im lemon lime googling fall meme answer line hint posted still matches googleline hint take reflection vertical fairys competitor line hint fall means final one clued distance line hint confirms answer calculation find algebraically ultimate hint line last words
60499	ascending words words letter written ascending ordereach clues refers ascending wordexample type meat beefif sort letters beef result order beefwhat intended words find last hidden word form words fashion dialect similar bright inquisitive one playfully mischievous number kind hotel dynasty china kind fish neither monetary unit void
80983	bob never beforehe boards plane home stateshortly takeoff becomes nobody else plane mwhen arrives destination hes longer mhe boards another plane go back home arrives hes againwhat mhint looking word beginning
3165	houseleaving party old house challenged four friends guess number new address three digits responses got amused one got one digit correctly right place two digits guess match placewhats house number
31843	move faster one blinkand base eati torture body wallet bothwhile feet reusedwhen living source much foodand soldiers lay close heartswhat ihint shop definition goodanswer stockexplanation move faster one blink stocks change price owners incredibly fast base eat soup stock torture body wallet stocks medieval torture device stock market ruined many feet reused stock footage living source much food livestock soldiers lay close heartsfor shop definition good shops stocks goods definition
17510	well known best jeweller puzzovania shop always well stocked pockets always bulgingone day local godfather puzzovanias organised crime comes shop naturally owe favour doesnt parts hands diamond size hens egg tells requires daughter shes getting married understand want bestcut diamond whole puzzovania family honouryou nod mutely inspecting diamond awe biggest one youve ever seen decide would prudent ask diamond came listen friend diamond needs cut shape convex polyhedron size shape doesnt matter matters every face polyhedron needs different number sides daughters changeable character never quite person twice want jewel reflect think manage meof course godfather stammer imposing gentleman taken leave sit still holding diamond wonder youre going need call mathematician possibly puzzlercan satisfy godfathers wishes construct polyhedron required prepare best suit since hell probably invite wedding reward prove nonexistence polyhedron book flight country somewhere far enough away reach powernote puzzle sounds much better read godfathers words marlon brandos voice
64615	one day man hunting saw animal fired gun realizing mistake seconds run soon dead happened
54376	take matchsticks set pattern viiin mathematics roman numerals move single matchstick answer one
78952	recently began creating logic puzzles thought id share easy hard easy one get warmed uppuzzle informationa group friends john heather mike decided log many hours per week visited favorite web site based clues find visited site longcluesjohn favorite site techcrunchstackoverflow visited hoursmike visited hours web sitesstackoverflowtechcrunchwschools peoplejohnheathermike hoursfive hours seven hours ten hours
48232	move single match make following expression trueso far ive found valid solutions find moreedit lots great creative answers found represented among answers plus quite clarificationsi changed equation expression title question mathematically pedantic officially allows inequalities expression still logically evaluate true false boolean sense wouldnt count even though might treated true programming languagesyoure limited perfectlyformed ledstyle numbers although using single vertical match kind stretching ill allow gets us good answers
60523	number thinking ofheres set cluescall sin mess θ κ engage emotionally half byte mottle never mix meds gin ‐ get answers right thats percent solution need justify tooi clues left heres second setsing matter frogs pole heroin slap toy asking question pse
50283	addition standard kakuro rules grey shaded cells must form valid sudoku solutionone sum puzzle corrected fortunately location nobody resolved yet everybodys progress point still valid apologiesif building previous solution please verify working correct grid see grid circled correction
27755	vicious villain ithe greatest kindcovering face eartha fiend mankindalthough may appear weak smallgreat power assignedthose fail heed warningcondemnation findtwo natures havea son god devilthough temples built methieves exalted higher levela loud cry sounds towngloriously appearance madeconsidered enemyand nothing afraidanswer puzzle seeall secrets made clearconsider though proceedall riddles appearhint every line useful determine correct answeranother hint please view attempting answer something tangible concept property
11377	treat baby abode good dont think origin asteroid believe alien traveled millennium distances may whistler ears know alien treat longhorns head black color combs hairs believe alien able see jupiter sky wander sky color blue come know believe alien would add hints every hourshints lines specify characteristic codesee seems odd words lines see edited tag computers believe alien lines added buffers dont deviate actual objectentity see first line carefully biblical meaning would great hinti think hint end question see bold sentences matters solution hint hint combine get solution
25715	inspired one tolkiens famous riddles hobbit nolegs lay oneleg twolegs sat near threelegs fourlegs got someto create new riddleoneleg took fourlegsto place legs twolegs came laterexplain describingedit heres hint oneleg riddle referring fly kind dont wings sometimes arms
81015	quietly walking among us words actually superheroes disguise diana prince spins around become wonder woman seemingly ordinary words spin around reveal super identitiesfor example stressed turns desserts need reviled turn around delivermeanwhilepoor little think sitting alone thinking could become knight spare g mere mortal word without powers transformation well never fear shame using accessory ten enable superpowers respect batman green lantern iron manso stingier become fiery reignites emerged become brilliant doctor degree salami become fleetfooted impalas addition e sold separately subtraction responsible lost missing pieces addition p included wait theres wellstocked utility belt words take multiple transformationsfor example dual becomes duel following transformation sequence dual u lad led lets see help superhero words find transformation sequenceat step may add subtract letter choose dont need alternate additions subtractionsas always construct puzzles way solved using wellknown words find conjuring increasingly obscure words may overthinking itthe first three get warmed serious start scam end mages suggested intermediate words start trooper end trooped suggested intermediate words start xenon end wok suggested intermediate words start sleepy end sleeper suggested intermediate words start seaport end spirits suggested intermediate words start knight end time suggested intermediate words start guru end series suggested intermediate words start blog end suggested intermediate wordssuper helpful hints diabolical distractionsguar vs gaurtaro vs tarot epiloguewow really got refresher vocabularybuilding words gars dit demit sou sot si stim stob nob ta tat nicely handled mohirlnote solution provided piisnot well done feel lee longer well known take look solution provided arbitrahj detours around using see eves sever revels lever reelalternative solution seaport tropes sport tops pot oat taro rat tars sat teas set ties sit tips spits strips spiritsalternative solution knight think knit stink nits sin sit ties set teas sat tars rat taro oat lot toil lit tile relit tier remit timenote solution provided piisnot uses gars alternative segment rag par rag garb bag grab bar crab arc crap paralternative solution blog gob bogs sob bobs bob bomb mob boom moo doom mod dorm rod doer red dear rad dart tad ad dab baud dub buds sub us sun nubs bun snub bus stub tuba
17531	backgroundi asked question words longest word repeating character pairsthe goal find word every character pair repeated least vulnerable dictionary searches didnt require human creativity addition every answer format stringsame stringfirst letter string instance alfalfa alfalfa fact quick nontechnical figurings format possible format fit challenge answers found interesting conclusion found interestingchallengeform grammatically correct sentence every letter pair appears least twiceclarifications example invalid intended assist clarificationwords repeated variations word count repetition includes plurals possessives contractions etc uni unicorns eating unicornswords count repetition match converted uppercase nonletters removedany nonletter spaces hyphens apostrophes etc stripped prior analysis result string letters unitheunicornseatingtheunicornscapitalization matter convert uppercase helps unitheunicornseatingtheunicornsdisclosure dont solution yet
