49152	room digital weight scales big book digital scales small like ones see small stores identical aspects read button pushed gives weight reading second readings whole pounds fractions one scale accurateone scale always gives pound less readingone scale always gives pound high readingby taking two weight readings determine scale accurate one gives lower reading one gives higher reading stand scale
118788	certain times year travel hours time crossing km bridge
57349	assume privileged invited attend party arranged prehistoric time hosted none adam mythological man per religious beliefs first man created god allmale partyyou accepted invitation attended party attended large number peoplehowever party sure host adam task identify though observed attendees semicladseminaked course expected time prehistoricyou thought moment got means identify adam wasquestion means identify adam wasnote fictional question intended hurt anyones feelingssentiments manner whatsoever
81925	following letters something common may obvious first glancea b h pno letters share attributehint misspellings typos title question maybe clue thoughmore hints may follow question answeredsome great answers far upvoted none exactly looking forhint number character also property said letters share hint correctly identified redbaron ascii table key good reason sum mentioned title two reasons two mentioned
94216	dont know rebus words represented picture try figure word phrase picture trying represent phrase
12299	two types logicians knights knaves knights always give statement true whereas knaves always give statement falseafter listening conversation logicians gather following informationlogician claims logician knight logician knightlogician claims logician knave logician knavelogician claims logician knight logician knightlogician claims logician knave logician knavelogician claims logician knight logician knightlogician claims logician knave logician knavelogician claims logician knight logician knightlogician claims logician knave logician knavelogician claims logician knight logician knightlogician claims logician knave logician knavejust using information gathered possible determine truthtellers liars explain notnote confuse xorbonus would answer become ors became ands
32780	little rebus mean fourteen wrong whateditok way many answers reasonable match rebus avoid another flood notsonicelymatched answers ahint strikethrough whatever called pronounced per se adds meaning rest pronouncedanother hint hit jack
18445	ive got riddle friend worksay dwarvesthey receive little dwarven shirts numbers repetitions enter room see dwarves numbers numberthey need decide algorithm entering room call number time least one dwarves number shirtwhile room cant exchange type information cant talk arrange way like sorting suchwhats algorithm
98319	numbers signs using numbers signs compose expressions calculate sum difference concatenation operation valid edit number must used exactly sign used number times minimum number maximum number obtained single wayquestion possible compose remaining integers range integer range composed many ways exist
120848	question closely related green hexagons puzzlestart choosing triangles green triangle sharing edge least green triangles becomes green repeats long possible whats minimal number initial green triangles make triangles green solution suspect minimal proof
20497	ownrulesa “ word ” entry dictionarycoma “ sentence ” text grammatically correct complete meaning english language starts capital letter ends dotrepeated words allowedyou allowed use punctuation colons quotation marks long ’ making lists ie cheatingsentences rated word count however proper names count one word since trivially extended simple proper nouns appending surnamescommon words changed proper nouns although allowed long appear dictionarycomfinally suggested sentences text inside quotes must actually make sense gibberishthat ’ good luck puzzlers
36882	two rivals meet one points appointed man proceeds howdy sup yo hey sup hello hi hullo u person gestures u shape received skeptical glance howdy ho adiosperson looks surprised briefly thinks bit looks sad say get next time walks away dejectedly days scheming person believes triumph plans encounter person hola hello quite smugly howdy hiya hullo madam heya wuzzup shalom ahoy salute hello morning greets welcome dagnabbit person looks expectantly person sighs fudge goodbyeperson smiles walks away victoriouswhat happenedhint rivals competing way unique
2066	image draw straight lines pass circlesas soon start drawing lines cant take pen draw six lineshint dont keep polyline inside squareeditbest answer one straight line passes center circles
8216	segments make number visible invisible like digital clock vertical segments sides horizontal segments centerwhats largest number form number visible segments number representsfor example formed visible segments digital clockor visible segmentshow large numbers get largestnote number many digits wishyour answer valid state answer came conclusion
79898	accounts nine pirate lords one impostor amidst voice story impostor die first chief hidden songs death second lord brought dove largest army bunch third known named foreigner original one fourth lord cruel lost dragged titan abyss fifth pirate known helen aged yet classy may call tethys others hybrid sixth one birthed iron feet clay known greeks horse superiority seventh pirates distant relative heracles though possession roman army eighth pirate reigns dont let waters deceive name ninth lord reigns waters describe name tenth pirate may met moses columbus looked found third instead answer yet truthfully pirate deadalso free bonus points whoever figures title referencingpirate name needed number also tell exact name sea thats important partclue pirate one traitor whyclue homer sirens whats clue whats prominent sea surrounding greece
81947	assemble formula using numbers order make may use operationsx yx yx times yx div yxsqrtxsqrtleftrootuprootxyxybrackets clarify order operations concatenate two three digits start concatenation numbers calculations permittedas long operands either note double triple etc factorials ndruplefactorials allowed though factorials factorials fine
73756	see running legs seen like return places ive sometimes get angry mad love wrap warm dad often ill jump left right im clumsy fall height ia side note may confusing people wrap warm part line much important dad part linehintnote one line riddle clue different word word type amhint two astralbee close
30	told possible guarantee worse tie normal x tictactoe first move important important first move
112671	take blackest pits yearns lightsee fruit distance nightnow warp fruits name turn bassand answer pull chasehints answer first line one inch wide bodypart head answer second line often used make alcoholic beverages third fourth lines dont actually rhyme answer another name like tool
102435	goal find sequence program max commands move triangle robot grid make visit squares marked startwo types commands usedp makes sequence start overthe arrows ↑ ↱ ↰ move triangle forward make change orientation clockwise anticlockwiseeach command need color colored command executed triangle square colorattempting move board allowedyou play want signup required im devits since posted one hope like changes ui oct edit link temporarily directing different puzzle fix soon
86053	harry hit man hired whack vic victim vic lives apartment complex illustrated vic parks overnight circled parking spot always leaves work around harry begins walking back forth driveway gray area waiting vic walk apartment drive past harry harry repeatedly walks point b c e back c b first three times point e harry sees vic ’ car parked circled spot fourth time vic ’ car gone car drove past harry driveway way vic get awaythis easy puzzle inspired neighbor drove one morning without seeing
16423	see none might glee easy thing rid come go fast readily might notice look carefully look family may end changing might influence us pretentiouslywhat thing talked abouti add hints later necessary let know broadif enjoyed riddle rhyming riddles found
61483	goes riddlei fragileand many colors comeyou touch capbut touch stemunfriendly air meetwhat hint nonliving thinghint everyday objectmore hints present comments answers
53292	puzzlepal anna rome shes travelling husband morgan theyre architects well versed math wanted tell liked rome much instead directly telling sent riddle loan return always even odd dont get maybe next month ask husband dont get stressed life live dont think far forward youll end heinous piewhat trying tell answer one wordhint anna quite perfectionisthint clarify de morgans law required solve first two lines deducted rand althor oehm de morgans law state two events b lnot land b rightarrow lnot lor lnot b translates nota b b lnot c lnot b statement lnot lor lnot b c lor yeshint title contains subtle hinthint based gareths answer stressed live evil desserts heinous pie didnt use sweets bad sahara satanhint order truly find answer repeat said dont think far forward follow words jedi master
22575	messing around one evening made six small drawings one friend minemy drawings made specific taking action object represented rip nonalphabetic characters discard one letter yield respective friends first namefor example drawn something like thisyou could expect talking marriage marry would action yielding among unusual names mary happily friends names considered normal spectrumcan guess names drawings belowfriend friend friend friend friend greatest friend love note order changed one drawing forgot add list
65589	sahara delicious tubergreek cheese asian sword waytranslucent dead getting oldercommunication device outdoor shelterheawy iron block neesons nameshining coating exists foreverprime prime standing infinitystack gone rong carbonbased
4149	youve seen often know wellmy name scribes sages tellmy many kin also knowbut im famed kind goone sisters love grand largesseanothers like lessmy brother shuns grand appealhe much prefers meager mealour distant cousins always inand implies hes also kinand one village holds anotheryoull often find eldest brotheri keep peace great panachestrike neighbours clashor leave samebut tell friend namepuzzlers politely encouraged place answers spoiler blocks avoid inadvertently spoiling fun readers
36919	longest pair words find rhyme also synonyms used describe phenomenonfor instance spot dot goal longest total length example would scored quick thesaurus check improved spotblot high scoreif may unclear two words synonyms please provide explanation examplei realize may turn competition best dictionary thesaurus programming skills challenge either way
30776	see right nowif look tech andgasp beautyi everythingfrom tiny bigim almost emptywhat
16443	offer breathing without breathand dancing round roundin mostly perfect timeand promiseill never miss stepthough diving flying drivingits upon stairsfrom kitty hawk clermontmoving wherever whereverwith whoever whateverbut want truthnothing anywhereexcept perhaps round bendtheres two ways itmy brothers never told liebut ill deceive way canand stumble upon stepsyou wont find mei never stop never restand though may appear leftnothing stepshas ever felt need diewhat ifirst hint heres half way solve clue fact key door like lens altogether unseen however long eyes persist certainly tell youll never walk locked doors door door exist second hint inbetweens cascade across steps though doors walls metal bars cels always keep things kempt
14400	come follow patterna b eb ca qd b lthena c b
71748	use make number rulesyou must use digitsonly digits used make multidigit numbers numbers examples square function may used may cube raise fourth power function raises number specific poweryou may use operation use digit example acceptable youre trying get usedhowever cant used get uses extra sorry integer function may used may round floor ceiling truncate functions sqrt may used functionsplease bruteforce methods good lucki see many answers like doesnt use factorials upvoted one gets creditwow guys good
70	n logicians wearing hats n different colors hat one color multiple hats color logician see colors hats except logicians must simultaneously call color win least one logician calls color hat agree strategy beforehand set possible colors known winning strategy ie logicians arrange win matter colors hats end beingi definitely didnt invent dont know didi know solution requires little knowledge abstract algebra read sketch solution math stack exchange solution doesnt require mathematical background specifically explain solution someone isnt familiar modulo arithmetic mathbbznmathbbz hint want try solve start n — white hat black hat work n — red pink blue cyan
16460	one night man receives call police police tell man wife robbed murdered body dumped remote location reach crime scene soon possible man drops phone shock drives minutes crime scene though man evidence committing murder personal blood signs foul play car possessions soon reaches crime scene say anything police arrest suspicion committing murder course judged jury peers etc without sign typical evidence police think committed crime noted takes place typical world without aliens super powers unlimited quantities material
47180	live highon top home dreamswhen treated right really gleamwhen treated wrong ill fallbut ill leave even brightness behindbut even sadness consolewhat
45133	situation made designed make sense requires lateral thinking takes place alternate universe discovered lot technology earlier say ww old man years old one leg sits wheelchair white lab young blonde rimy man appears room strangles death two hands clear anger eyeswhat could reason beedit edited make less broad
102479	daughter relative mine fifthyear school student russia got following math homework teacherheres translationlogical taskno students solving task figure missing numbersdiagramthey came different answersthree diagramsfind rules used students fill squares come fourth solutionexplaining first two solutions easy first solution student assumed horizontal line sum first two numbers equals third one second solution student assumed difference numbers vertical row samethe girl couldnt explain third diagram asked parents asked unable help im posting questionmy question logical explanation third solutionlooking third solution noticed numbers horizontal line add number could one get original diagram first place also digits horizontal line add number could one get first place seems stumbled upon false leadsbeing professional physicist feel ashamed tell girls parents cant solve problem find likely teacher made mistake third diagram im afraid bet possibility hope suggest valid logical explanation third diagram thereby help save face
79951	consider following mazeyou walk black lines aim go green mazes bottom red left side however time reach intersection three black paths spokes must turn degrees either direction rather continuing straight find valid path maze prove solution existsits lateralthinking puzzle solution trickif arrive corner simply follow pathyou suddenly turn around walk way may retrace steps otherwiseits puzzle creation already solutionthe missing line middle maze intentional
43092	came logic puzzle inspired xkcd comic dont yet answer wondering anyone come one room three doors two doors lead one leads certain death door guard holding spear stationed front one guards always lies one always tells truth third guard fatally stab ask tricky question question isnt tricky tell truthfor puzzle tricky question question isa metaquestion guardsexample asked guard x topic would saya question asks hypothetical situationexample asked topic would reply liaranother example n doors asked question x would respond
22614	winniethepooh keeps honey pots larder pot contains kilogram honey different pots contain different quantities honey pots together contain kilogram honeyevery day winniethepooh selects pots picks real number x eats exactly x kilogram honey selected pots question always independently initial distribution honey possible winnie empty honey pots finite number days
82007	cindy tyler gave birth beautiful boy wanted husbands suggestion name husband away mining exploration job texted beautiful boy please send name suggestionher husband mining materials scientist riddle enthusiast sent following note burning radiating light strong noble hope universally abundant boywhat suggesthintall rearranging words make sentence look elements decribed rearrange themhint noble metal one element gave specific name cindy tylerhint rearrangingthe boy noble radiating burning light strong universally abundant
65623	three animals clues separate one another get harder progressanimal live shadows dont let anyone else play bushes animal ripped hurry left h homeanimal long surf onety one baby sheepobviously fool answers youhint animal first lines viewed separately fourth hint animal answer waaaay hint big hint based already discussed comments looks like lambda hint visible certain times day hint used help sailors navigate
75867	bar mitzvah ceremony takes place th year jewish male ’ life day could exist two jewish boys jim would born first day month john last month year yet years later john reaches age bar mitzvah jimhint related final answer httpsenwikibooksorgwikimathematicsofthejewishcalendaranniversaries
16477	upon time band colonists distinct birthdays settled remote island brought mementos old country around certain mores regarding friendships birthdays eventually developedmaking new friends encouraged care ever break friendship unthinkably rudefriendships mutual call someone friend would say unthinkably rudewhen someone birthday friends expected give birthday present exactly one memento memento give give one memento unthinkably rudemementos may given someone birthday give memento day unthinkably rudeto give friend memento gave recent birthday tacky ie unthinkably rudeone fine stormy day castaway washes shore nothing clothes back small portrait family counts memento island reckoning brought leader making sure sailor doesnt share birthday islander explains local customs make least one friend soon says friends would looked unthinkably rudeare many people asks many mementosyes many says n islanders perfectly polite many mementosthe refugee hesitates want rude want put someone else tight spot safely make friend scandal inevitable
92254	balls come two possible weights using balance scale times determine whether balls weight notnotes got riddle mathoverflow page riddles coworkers tried solve balls pretty easily even doesnt seem possibleunfortunately page doesnt contain answer riddle doesnt exist anywhere else internet original author longer active dont know answeredit ive asked general case mathse
69733	five people discussing hobbies like baseball says man prefer hiking answers woman love persian culture tells second man weird like slice things says another woman really enjoy eating evening tells last manafter brief pause one finally says well guess im welcome ill see outwho
84069	assume jigsaw puzzle also tessellation means every piece identical shape assembled pattern fills plane gaps jigsaw puzzle might look like thisor weak definition even thisnow people ’ recognize triangle grid “ jigsaw puzzle ” none pieces interlocking anybody starts trying create definition geometries constitute “ interlocking ” let ’ take look third exampleyou first note two adjacent pieces actually lock together simply slid together apart look red “ fault line ” drew overall pattern try separate puzzle along line notice pieces zigzag enough locked together ’ move apart however still pull puzzle apartthe teaser questionhow pull apart puzzle pieces must stay plane table suppose sake simplicity lets assume one piece center adjacent neighborsbut real question iscan design single shape satisfies followingit tessellated cover infinite plane gapsany two adjacent pieces interlocking themselvesby assembling number pieces together beyond two pieces become interlocking thus slid apart waythis intended reallife question math needs check tooalso used cad software designed problem im assuming dont ill try help people providing feedback thought good idea didnt pan dont feel bad tell youre wrong funthis question answered florian f approaches could solve came two neither like one ill maybe post mine eventually anybody keep trying ive added openended tag
32874	drive play take dont contemporaneously laterally b z whatever case please take seat listen fall asleep identify mehint must seen begotten pen machine several things share name stop calling bus
36973	love mebut got haters tooi play workingi working playingsometimes soothe mindwhat
65645	food youd never find certainly wouldnt eati dont exist yet isnt feati good example something wrongim mentioned speech often heard song iclue real difficult say exactly although certain dr hay would tell im good two ingredients never mix together senseclue best hint give without rude tell work backwards im literal food certainly sound foodlike mentioned speech song think lines youll answer longclue im disappointed need another clue really try display daring perhaps youre biting time afraid feeling flustered please submit best attempt might pass mustard
4207	im hiking need buy bus ticket mountains ticket costs £ following coins pocket x £ x £ p x p x p p x pweight everything youre climbing big mountains want make sure im carrying little possible set luckily foresight check royal mints website look exactly much coin weighs £ grams £ grams p grams p grams p grams p grams p grams p gramsits around time consider moving us using notes much lower denominations would really benefit perhaps next tripbuses uk often expect exact change coins give bus driver im left smallest possible weight carry hike much beedit whatever little worth p £
20595	perfectly symmetrical small legged table standing large room continuous uneven floor always possible position table way doesnt wobble ie four legs touching floorno tricks lateralthinking serious question reallife applications serious answerthis might look like itd fit better lifehacksse answer nice mathematical proofformula depending whether yesno wont give game away surprisingly simple elegant
53364	one find forums lot exercise pupils call help solve maths came across exercise similar onedetermine simple nonscientific calculator integer n n fastest answer calculator best
4211	something everyone needs use many times different ways sometimes use part others use always turn bend use scare confuse even question even use confront someone like say bill rest confrontation absolutely use every day guys dont mind made part youthe original question httpspuzzlingstackexchangecomusersjamesmassey answered httpspuzzlingstackexchangecomusersjnf found guess object riddle part latest mine httpspuzzlingstackexchangecomusersdalarcop answered httpspuzzlingstackexchangecomuserskami found guess object riddle part others found listpart httpspuzzlingstackexchangecomusersjnf guess object riddle part
16501	im jack uses durable strongbut useful childish construction toodesired alike man womenkindwanted obtained fewwhen shortened im impartial judge prisoners mathsome changed set freebut discrete gift whole truth ill gladly tellif im used programmaticallywhat ispacing intentionaledit slight hint since everyones guesses seem generalevery line well title specifically necessary though second verse could applied number things extend verse people obtain answer stomach work
28794	seven cowboys play coin tossing game fair coin player chance winning plays six probability cowboy wins exactly three games
59517	girl named rima born died alive years months possible
34949	solutions puzzles brain hurts trying figure choices box
53391	every day back forth go lean forward back legs move four matter hard try matter time move legs never move place powerhint look like live yet notwhat
102544	saw day took picture another nearly identical wet patch spaces awaywhy pavement wetnote straight forward physics puzzle ordinary parking lot ordinary usual interactionsnote matthew jensens answer quite reasonable however case car present parking spot rain
10385	say ’ breath fresh airthen spit break loudlywhy trap darkest placesmy skin may pure white face also redmy cousin may spicy hot sweeti amedit first ever riddle great answers think riddle may specific thought originally ill try add specificity
6288	hello everyone name jayi work hours daybut dont get wrong know silent boband got nothing weed jobmy kind meif know body chemistrywere human mostly thingwe many shapes air kingour children could surf seafor monstruositythey fly bounce bendbut always us endwe get give even alivebut best need good drivefor make work lot possesseven destroy working excessthis riddle difficult im sphinxin fact im well sure glimpseeditim deleting easy difficult part think got thinking wrong directionhintsjay name dont focus jays objectsthe chemistry im talking well think verylittlejays nothing sphinxes
59544	edit realized people somewhat distracted actual word images supposed represent simple word people search picture means example people guess blackjack instead dealer first image instead picture shows next time create puzzle make sure people get right track make puzzle complicated people expect one beedit long wait post correct answerhint dealer neck flip life xyz
