5588	market suitcase let start making clear need suitcase point point trip plane cold weather destination lots baby stuff souvenirs carry backpacks carry etc gon na cut l ought trick general preferred squishy canvas softcases along lines nicer lug around something sharp edges always expand pinch magic zippers extra space rock pretty close unbreakable incidentally bag like much luggage antler brand found generally strike reasonable compromise price quality things get squished like scuba gear used ancient samsonite plastic hardcase suffered many hard knock years finally gave ghost lock broke understand plastic lame cool kids using polycarbonate hardcases ideally original rimowa salsa topas pop oz way target price range everybody making copies eg antler liquis goes bit like pay entirely question really worth oz prices please taunt much cheaper us finally question new bag soft canvas polyester hard polycarbonate something else recommendations specific models brands also welcome
153052	said question safe prepaid mastercard mean financing travel amount card problem since linked bank account recharged easily banking app credit card debit card mastercard use daily would like avoid bringing also bring cash expenses already covered advice general record italian traveling india
103901	flying easy jet wondering retuning flights old luggage tag suitcase take arriving airport return home leave person us anyways im guessing even self check someone make sure old tags taken new one correctly done etc
77278	september arriving geneva airplane approximately need go lausanne two questions need buy train ticket online buy directly station without problems problems trains always full permitted buy ticket etc moreover tickets specific train like board train geneve lausanne ticket get airport geneva train station low budget possible guess walking option though much cost appreciate answers people able find exhaustive link website okay
118236	applying chinese visa requirements photo size mmx mm width head mm mm height head mm mm live missouri sucks tried cvs walgreens walmart nobody shops offer standard us passport photos
81378	noticed french tgvs window opened temperature necessarily controlled air conditioning curious air conditioning set specific temperature cold like often airplanes ambient temperature like figure take extra sweater trip temperature winter summer
1507	whilst taking train london östersund northern sweden quite frequently usually plan get free day copenhagen looks like london brussels cologne overnight copenhagen day sightseeing copenhagen malmö overnight stockholm östersundanyway getting pretty bored copenhagen wondering possible rearrange way could visit e g berlin city taking amount days travel e overnight segments
105954	travelling koh samui hour stopover bangkok assuming would need get onto new plane arrive bangkok follow people plane sure would go signs follow gate would wait general anyway stopover would great know countries want go involve stopover
60902	reading paris travel around read book standard subway ticket valid hours ticket usable exit enter hours inside metro alternative ticket allows note really sure hours since found contradicting information
97768	flying later year dublin munich hour layover connecting tokyo flights booked expedia lufthansa ticket getting quite anxious length layover especially first time munich airport therefore wondering whether possible book separate way ticket munich dublin gets munich earlier get connecting flight allowed able check drop luggage connecting flight issues could arise
3560	always lists popular countries travels found going grain super rewarding places like chernobyl ukraine desert uzbekistan mountains tajikistan travelling highlights reading mostly fluff piece least visited places world made wonder need statistics back please country fewest tourists people countries coming country tourism every year three caveats antarctica country purpose soldiers entering iraq afghanistan count touristssince countries come go ideally would simply recent statistics find likely statistics
108010	venice tourism site lists bunch rules okay swimming canals littering also allowed duh something baffling “ standing time ” – even consume food drink exclusion restaurants cafés refreshment areas really case standing still seems bizarre surely much worse checking map phone using camera remaining motion times
7658	leaving friday city trip paris arriving noon already leaving paris monday evening clock really want see louvre versailles eiffel tower want take french breakfast local café preferably tourists much paris cram days need visit importantly order need visit local sights student budget around euros
21994	someone never used toilet paper ever travels countries toilet paper used could one learn use toilet paper one asian colleagues friend confessed going paranoid knowing fact use toilet paper travelling staying us alright stationed dubai bidets water used wash looking west videos dummies tutorials one watch youtube tutorial either suggestions please
7663	travelling western europe would like dine restaurants expected tip waiter waitress tip paying bills credit card prepare coins purpose
1520	girlfriend got new job requires frequent travel shanghai china chinese phone sometimes internet access aside skype internet communications cheapest way call china also cheapest way call hidden fees watch depending method use
101872	two months ago girl booked vacation berlin germany wanted see u first stop miami beach th want stay days continue nyc later go vegas come back miami th september stay another nights expect hurricane gone th idea whether okay okay means reach hotel sleep suggest know question primarily opinion based germany hurricanes know fast state recover
126450	seems intuitive order bags reach carousel random every time fly time reach luggage claim area bag never wait even though bags aside statistical effect must flown times though thing think fly economy usually bags handled later business first classes however since travelers business first class leave plane earlier also get luggage claim take bags e bags already carousel belong travelers already collected
177657	vacation next week japan problem heard people japan use chopsticks never used stuff going learn restaurants japan provide knife fork
9723	finished road trip countries central europe wondering whether would come across drive restaurant mind visiting one next trip germany mcdonald used tons drive ins actually mis labelled drive thrus think call mcdrives seems still think germans pronounce th looking place park stay car waitress waiter comes around often roller skates take order deliver well eat car
3589	demoscene party revision occurs every year easter weekend saarbrücken germany thinking attending year live england looking methods transport getting looks like plane tickets going extortionate usual £ return per person thinking driving instead since two us perhaps three depending split fuel costs enough cut cost planning taking channel tunnel calais driving belgium round edge luxembourg actually crossing border germany google maps says hours guessing probably end around hours total never driven another country looking tips remain comfortable safe save money list far bring spare food drink clothes blankets fully stocked first aid kit flashlight spare batteries plasters medical insurance cards etc plenty tools spares car including spare tyre jack take maps well sat nav low battery lost phrase books secondary phone left switched fully charged emergencies also unsure situation border fees car insurance breakdown cover need inform authorities country driving get appropriate documents case covered automatically eu
185863	rail fly ticket air europa fra rail station eastern germany around hours away last segment ticket marked fra qyg flight scheduled arrive january th strike affecting trains germany unclear whether able reach destination also checked buses fully booked tried web search find information rights case train connection also unclear whether complained airline deutsche bahn advice topic would greatly appreciated edit trains currently running ticket scheduled via frankfurt hbf later afternoon db representative already confirmed trains run today wish luckedit surprisingly train available afternoon less full arrived time limited time schedule could say running better normal day
79368	way anyone reading old question posted early days samsung exploding phones event traveling around heard nothing news batteries catching fire course weeks since appears latest product completely recalled worldwide one expensive recalls ever long flights yesterday including aa ok sometimes happens interested standard announcement ways use cellphones flight take landing added extra bit recording absolutely use specifically samsung galaxy note time whatsoever must turn utterly getting plane power plane say reason excitement secondly aa airlines saying thirdly extra anti note feature us countries cheersi assume added relatively recently days since model released recently right fyi aviation dudes discussing subtleties airline side https aviation stackexchange com questions procedure safely handle ped battery problem commercial flig
91656	many transit apps websites provide information optimal tube train section carriageto enter part journey planning order make use information unless one wants risk running along busy platform gathering crowds train arrives one needs know direction tube train pass station platform general way standing platform determine — perhaps subtle signage clues track arrangements even something infrastructure platform — direction tube train especially deep tube train pass station platform way anticipate announcement sequel riding train side doors open
114183	adults teen older folks visiting relatives washington dc summer july reside brookmont maryland area far understand driving parking dc might difficult people washington vacation th july less people driving mostly around national mall maybe georgetown day available parking areas offer reservations transportation options closest metro looks friendship heights really close brookmont either got back washington dc parking easy parking everywhere even block white house national gallery first afternoon even got spot right mall parking meter personal opinion say road infrastructure mess age well canal road hw whitehurst worse
175629	need extreme silence work therefore wanted book room hotel facility minimum possible rooms specific filter booking com airb b booking service would allow search properties sorted filtered total number rooms edit extreme silence mean securing human interactions ie loud music late night talking etc work without problems non human sounds like machines nature
85518	travelling thailand th january days connecting flight frankfurt stay eight hours planning going city visit couple places eat well looking weather saw ° celsius pretty cold since going thai beaches bringing cold weather clothing kind rent clothing service frankfurt airport anything using regular clothing keep warm
67088	traveling london paris coach need cross english channel getting ferry bus entered parked ferry passengers asked leave bus come back hours later us wander around find place sleep two public decks parking deck presume safety reason reason seem obvious would need exit bus sleep somewhere
177681	let say traveling luggage city city c en route wanted stay city b several hours explore exploring city bunch luggage would first choice general rule possible leave luggage hotels even staying would several countries europe matters
77329	flight delayed canceled problems plane airlines backup planes case mechanical problems plane use cases reason
9747	us rule taking domestic flight taking international flight luggage allowance international flight apply quite possible taking flight small airport big airport catch international flight airlines regulations rule imposed government
5650	four years since last international flights flying air new zealand us oz seeing weight limits carry baggage carriers actually weighing carry baggage days never anything carry weighed surprise potential excess baggage hassle edit march th bags weighed sfo mel flight could due flight rds full saw nothing carry weighed air nz happen hear american airlines announcing every carry bag going one flights would measured weighed bit pot luck involved
13845	girlfriend currently living different countries meet occasionally days every month really care much going long need visa eu place time couple days short flying airport aaa flying airport bbb need find airport xxx euphemism cheapest fly overall bonus task flights first foremost could live somewhat expensive accommodation long get easily since accommodation cost comparable flight cost short stay like sort rough idea going pay certain type accommodation example three star hotel
146965	visiting louvre recently tried ignore lines leonardo mona lisa looked great art instead michelangelo dying slave many works raphael display somehow managed miss notice donatello works huge museum know several well nevertheless visit sparked obvious silly question museums artworks four ninja turtles combined course childish desire visit two found far two obvious places already louvrethe vaticanare others next obvious place look might florence lot closest could find uffizi gallery seems missing donatello
30227	get nothing declare line get selected random bag check anyway customs officer finds something supposed declare something small like plant product something supposed pay duty either forgot realize supposed declare definitely talking drugs anything else would land really hot water happens next
9754	know bring bottled water plane however safe bring empty bottle fill later risk losing possibly expensive fancy awesome water bottle going security
22050	thinking planning trip drive though every country europe know people driven though every state us information online plans trip time took however find much kind thing europe looking strategies people attempts successes driving necessary requirement either taking train would fine possibly preferable would go prefered place start constraints existence connections roads trains ferries impose
3620	would like visit places states sometime next year thinking road trip could start either los angeles montreal would like visit philadelphia phoenix las vegas trip plus whatever way national parks would top list mind transport excluding fuel question would get around could take trains public transport states montreal want hassle importing exporting car drive car states options see either buying used car sell end trip rent car look hertz com quoted including insurance month car seems like return car pickup location hertz choose different drop location shows available car pick wrong drop location b really option get different rates different locations anyone advice get cheaper searched relocation site find anything second option would buy car sell end trip hopefully get back anyone experience places better buying selling car state would get car amount money would paperwork involved buy car one state sell another anything else need know buying selling car
149029	visiting mt titlis switzerland single day th december th december activities would include riding cable car skiing kind clothing required duration time period
149032	read make international emergency call sure able call local emergency number usa using foreign india mobile number usa though mentioned usa would also like understand works countries well
38441	lot propaganda west leads us believe iran dangerous travellers go obviously major political disagreements several governments iranian government taken account human level met many iranians travelling elsewhere world found friendly charming hospitable also met several western travellers spent time iran including hitchhiking around country wonderful things say country people traveller learned trust hear travellers destination especially ones prefer similar ways travel also learned trust opinions inhabitants countries bordering destination country least yet people still insist iran safe traveller depends greatly area iran look general travel advisories issued governments disclaimers wikivoyage please regurgitate answers want know travellers iranians references specific incidents targeting foreigners westers parts iran problem parts avoided even experienced intrepid travellers realize advice apply israeli citizens unfortunately australian
83496	colleague family member struggles stairs able climb injury spotted trip tasmania jetstar sydney wondering planes stairs air bridge jet bridge flights jq jq prefer generic way finding information
155180	wife live major us city chicago considering leaving stay family rural area hours away reasons mostly safety seeing reactions toilet paper groceries low makes us concerned kind civil unrest might happen coming weeks thoughts would good go avoid possible looting rioting violenceemotional reasons family space easier keep distance people much smaller population around youpossible reasons stay possibly spreading virus wife light cough days symptoms health organizations asking us stay put although would remain inside got new place maybe overreacting chance civil unrest right lowi would like know official recommendations kind travel discouraged forbidden even unofficial reasons one option might better please let know belongs another network add remove anything update thanks advice made us reconsider staying put risk spreading anything
103982	rules merging onto us highway interstate ramp highway particularly busy driving colorado happened day highway unusually busy slowed able merge almost stationary traffic driving mph waiting opening meanwhile someone pulled highway zoomed past shoulder incredible mph honked horn want cause problems others followed ramp tried thing next quieter ramp rules say right slow traffic complete standstill made end ramp opening stop block ramp waiting opening things line perfectly duty miss turn order aid traffic edit kind ramp thinking think better term continuous comes mind
3631	friend mine currently traveling japan small tattoo neck wanted visit public swimming pool denied entry difficult understand reason seems tattoos look dangerous someone explain true visit public swimming pool japan tattoo real reason
142896	house see many planes coming land tijuana international airport km mi occasion also see planes assume coming land san diego international airport km mi two airports approximately km mi apart crow flies km mi road international commercial passenger airports different countries closer closest specify international commercial passenger airports know airports airfields closer relevant example brown field san diego km tij
132658	happens miss connection flight fault let say got distracted something airline may book onto next flight fault money book another flight stuck airport would best course action circumstances
60979	basically question indonesia coming year male plan travel indonesia java sumatra girlfriend probably travel several weeks aim stay larger cities also plan several multi day hikes nature would camp sleep smaller villages indonesia mostly islamic country shariah law enforced aceh meaning least one adjust behaviour compared couples behave western europe provinces java sumatra make question specific omitting possible cities might visit itinerary far set hope extended broad answer given also useful others visiting islands
146996	flight oslo rome delayed hours minutes submitted request norwegian air shuttle requesting compensation euros eu reasoning grant compensation inspect aircraft technical faults actually faults argue situation inspect aircraft actually nothing wrong constitutes exceptional circumstances questionin complaints norwegian travel complaint handling body eu online disputes resolution effectively argue logic correct inspection found nothing constitutes exceptional circumstances full text refusal e mailthe full text emphasis mine response airline automatically translated original danish flight disruption information norwegian flight dy osl fco delay time hours minutes reason disruption flight delayed due inspection aircraft following possible technical fault inspection technical defect found aircraft released operation without need replace components unfortunately unable meet claim compensation departure delayed due exceptional circumstances cases passenger entitled compensation irregularity due technical error accordance judgment c van der lans technical error results replacement component considered within airline control thus give right compensation case technical fault components replaced van der lans decision therefore applicable unfortunately meet claim compensation case reimburse following expenses applied food nok unfortunately unable meet request reimbursement costs responsible information please see order process claim need following information make bank transfer • name bank • name address account holder • account number information sent replying email information please contact bank case finalized soon received necessary information best regards karina customer relations team basis decision event cancellation delay always provide assistance eg accommodation meals telephone calls transport according eu regulation event passenger incurs costs event delay cancellation reimburse within reasonable limits costs deemed necessary specified receipt presented reimburse costs passenger allow us offer kind assistance costs arose result lost connection norweigan separate booking number alternative departures offered passenger appropriate norwegian ticket refunded flight canceled delay hours passenger chooses travel passenger entitled reimbursement new ticket norwegian another company reimburse cost new ticket price difference new ticket ticket norwegian norwegian ticket refunded additional costs directly linked service regulated eu regulation reimbursed reason delay cancellation within control believe passenger done enough ensure pre booked arrangements completed eg relocations accommodation events etc able cover costs even delay cancellation within control likewise cover consequential non documented damages expenses would arisen independently irregularity unnecessary legal assistance determine claims montreal convention decision norwegian aviation complaints board case number f conditions apply reimbursement consequential damages provided airline made every effort avoid technical problems caused delay cancellation flight article eu regulation additional costs directly related service regulated regulation may deducted standard compensation information rights visit www norwegian com rights disruption type delayedupdate complained norwegian travel complaint handling body threatened look case asked norwegian statement norwegian agreed give eur plus nok food one taxi rides cost legal fees thanks help
7733	arrived hungry new city desperate need finding good place eat need without guidebook recommendation one restaurant popping another many others hidden around districts give little marvelous dinner spend € dry chips burnt chicken rude staff paris decision important especially want taste local dishes techniques one use assess good restaurant spot
13877	often hear people object scanned radiation argument find always quite amusing people exposed higher radiation levels average airplane flight read article levels exposed radiation everyday live lost article remember exposure planes quit substantial somewhere order one body scan equal minutes average transcontinental flight question much radiation really exposed traveling airplane compared staying ground
36405	interested hiking fall france camping along way order figure gear need pack camp particularly sleeping bag would like know temperatures expect interested historical temperatures figure usual temperature might look seasons matters thinking hiking pays basque south west france mountainous part ideally online free find data resources cover europe even whole world
85559	traveled recently bus wondering comfort plane couple rules thumb comes picking place provides bit extra comfort e g sitting emergency exit provides bit extra leg room sitting right next toilet avoids noise etc apply bus better seats relation comfort provide thinking leg room although also nice also feeling less bounces well maybe noise reduction horizontal drag turning things may missing plus clarification considering long distance buses connect cities also called coaches rather city commute buses
38458	rechargeable usb electric arc lighter similar model one shown sorry ebay link best find find picture working activated creates electrical arc two points like element electrical lighters heating element gets hot e old car lighters anyone know likely get confiscated airport security know lighters supposed allowed often seen confiscated anyway particularly china gas lighter fluid based lighters different although seem come close torch lighter explicitly banned outside resemble torch type lighter suspect security probably confiscate anyway confiscating lighters know good idea argue perhaps someone traveled one find official documentation
