93711	riddle inspired watched latest post episode curb enthusiasm se larry faced dilemma never really solved dilemma followslarry ordering private airplane fly mexico friends jeff susie cheryl leon donna safety fuel efficiency reasons pilot needs know weights passengers luggage getting weights luggage big deal however get weights passengers theres one problemnone larrys friends allow anybody know weight person weight private matter nobody know even larry partner pilot refuse tell larry anybody weightassume easily solve tools home eg industrialsized scale assume everybody knows weighthow larry give pilot information needs respecting everybodys wish keep weight privatei solution mind however solution works well valid watching episode wont help larry doesnt solve
58895	get add three timesnote tags problem mathematics lateral thinkinghmmoh yeah btw question title kinda misleading
36370	alice walks upward escalator counts steps bob walks escalator counts steps alice takes three times many steps given time bob many steps visible escalator
89619	someone please help find answers logic behind questions belowthe questions test taken websitehttpwwwiqbraincomexamplei could solve questions ones sure
40468	united andi old like winei popular east west buti misunderstoodi known several formsnames buti inclusive many themi given day buti good life timei present andi alive nowi help thati attained yousince one answered adding couple hintsi employed many fields nowi sanskrit originwhat
32277	may forgotten password tvall remember letters long involves lettersknowing might forget hid clue tv remote help figure passwordhint arrows correspond numbers think ithint line numbers important
26133	first riddle probably easy good luckan affiliation dogsmy culture like otherprogrammers use lotssometimes two brotherswhat ihint dogs rubber
42518	murderer condemned death choose three rooms first full raging fires second full assassins loaded guns third full lions havent eaten years room safest himdidnt make thought might like
5656	one plus one equal three
73243	assemble formula using numbers order make may use operations x x x times x div x sqrtx sqrtleftrootuprootxy xy long operands either operands may course also derived calculations eg may also use brackets clarify order operations may concatenate two four digits start make number wish may use starting digits must use three im afraid concatenation numbers calculations permitted answers concatenations get get plus one double triple etc factorials ndruplefactorials times times allowed factorials factorials fine upvote answers double triple ndruplefactorials get mark correcta finite number operations used answers infinite number operations get
36379	puzzle belongs puzzle series hypermodern artthe two friends move next roomyou know moving flashing painting next door niceim glad found something liked piece plain painting combined real keypad glued wonder really need pin get next roomlikely painting called maybe hintits strangely called dotting eyes crossing teasoh well guess better take hud definitely touch keypad without proper code ive burnt knowthe task find digit pin code image explain found image coded see need get number crunching digital dataive added enigmaticpuzzle tag purpose may want post partial answers comments well seeing thoughtprocess solvers helps improve puzzles ah spot mistakes
36381	look like supermanand could even save lifei fly faster jetbut im worldyou wont even know im thereso frequentlyill gone whistlewhat
32288	rectangle inside triangle one rectangles sides one triangles sides two corners touching triangles two sides prove area rectangle area trianglein words prove blue region bigger red regioni heard puzzle solomon golomb brilliant mathematician lover puzzles recently passed away
75297	previous puzzle kind bird without wing body feet tail invention effortlessly sail unlike lowly brothers deliver mail surging winds majestic without fail alas lie one shortcoming order useful made thin thanks lot darned cursed thing barriers shant break oh races ill never win say theres wikipedia article anything find mine declare puzzles kinghint stability issue creators seethat reason taught sweephint ufos generic shapei though space
44577	fall holey sleeves release load heave fiveyear mission made crew war boldly take action man taken dateline almost torn fire revenge lit successor came quite early yet body still varied intention retain reputation hard obtainwhat hint title inspired vietnam war movie quote made based military novel shared name though answer didnt starred quote may help identify thing behind puzzle wayhint tactical strategic even though results crucial may help lot solve puzzle put first two hints together also fit combine first two line riddlehint two names people used called one came navy came armyhint skill came handy became oldfashioned era
11811	mepros always let friends go first groups friends mean every matter around always effect strongwilled none friends change magnetic personality always near friends cons im short like alone clingy never accept groups friends instead try change always succeed im bossy usually one telling friends circumstances things going happen personalities one almost teenager mid twenties hint title hint dont overlook
30245	three riders need travel distance say km rough terrain running skiing etc walking horse trot two horses speed walking rider say kmh speed rider riding horse say kmh horses cant left unattended single person travel one horse whats fastest way travel given distance whats time takes travel using itnote calling taxi cabs cell phones blue portals jet engines timespace warps etc time please lateralthinking nitpicking puzzle
52776	absolutely certain existence ideal temperature range ºc temperature water freezes make positive improvements ihint every one probably barking wrong treehint title puzzle updated modified admittedly sillyenormously bigly hint clues hints common
17962	every real number coloured either black white prove exist distinct real numbers abc colour abbc
20011	work farm romantic think need wake around sunrise go work get paid pennies per minute take second job pay bills honestly id anything get apartment im sad sack itll probably never happenwhat namea correct answer explain clues im looking specific nonfictional human clues meant taken literallyps removed room board bit flavor folks ended reading realized people would see clue sorry thathint synonyms importanthint one clues punhint would someone farm wake around sunrisehint main clue refers thing mine moreorless kindbonus clue wish job passionate aboutbonus clue put heroic effort get bed
7726	variation riddle guards doorsyou stuck room doors doors guard posted one guard always tells truth one always lies third sometimes tells truths sometimes tells lies stabs ask questions reliable way solve
67119	pain attack witha plague appears mythin throat ill sequesternow hands ill festerfor see lying aroundunbelievable pain take downlets forget touch cant run awaywhat ihintyou may get hot around meyour hands feet pleahint disease commonly found childrensores always afflict
63023	big crossword development exists gerbil indeed journeyed knowingly long may openly present quickly really strange tales weird xeric young zips simply indefinite article existing particle worn ’ type hat entrance flat next go means weak hit shin moan whine funny good times ’ real dupe writer looks scoops unit pressure tied ’ running lengthwise side side many cells made nm tech upgrade emotional top fossil scientists ground shop power onefivethree measure reflectiveness sample degree great concentration particular skill ’ relating rock formations tectonic thrill lastly belonging power onefivesix ’ finished yet sleeve tricks spot patterns crossword see tell would answer
99889	arrange numbers replace letters soabcdefgh itoo easy many answers try firstthen explain
36404	playing dice game friend rolling two standard dice recording sum two numbers win two consecutive outcomes friend wins three consecutive outcomes strictly increasing order continue rolling one wins probability win whyexamples outcomes win outcomes friend wins
17973	phrase conforms certain rule call surpassing phrase™use examples find rule details save time font doesnt matter number words phrase vary chose short word phrases keep list concise case doesnt matter latest edit calculationpuzzle tag addedwhat surpassing phrase™
36405	rebellion earned fame events knew name origin none sure resting place obscure arrow bow left mark life foreign rule would stark towards end ran breath much later met death write many tale mustnt failedit line beside last clue hint doubt real hint hail europe im personseveral people made good guesses even fit clues nearly perfectly add little advice possibly create new ideas people assuming origin mean word many meanings try others also check comment sompoms guess guidance
15934	im starting suspect kind gag puzzle downvote please consider ive considered thatthe question many minutes second stipulation answer four letter word everyday use zero nada none none would really correct anyway ive tried math answers ive tried english answers cant come viable solution either thoughts
103999	came across beautiful puzzle decided create versionstart placing numbers anywhere infinite square grid place numbers order subject rule place number k sum neighbors must equal k largest number place
17983	solve following cryptic clue hint think rebushint look number dots think sport hint edited title lead closer
30274	ground airyou find creature hiding thereabove found belowindeed go hide awaynever day staymissing allchanged appearance dont fall hint finding
69187	new writing riddles bear one terrible prefix dream many life infix youd wish grew suffix crutch many wish speak minds view dark glow leave behind ithis one requires bit outside knowledge anybody high school degree heard point add hints every nobody gotten yet good luck feedback much appreciatedfirst hint though soft silky might seem id warn beware exposed might start losing hair
54851	puzzle based word™ phrase™ series started jlee spinoff number™ seriesi like adjective noun™ puzzles prepared earlierlets start easy word puzzlefringe words™ fringe words™amnesiachoppingisraeliparrotrevolverbeekeepersclassicdisappointrazorbaasaromasubterraneanflagstaffsleevetoilettwiddledweve many phrase™ word™ number™ puzzles set™ puzzle nb sets intentionally sorted inconvenienceleaping sets™ leaping sets™lets go back words againpersistent phrases™not persistent phrases™black hatadd headnew stun gunan ongoing gagthe tiny catand end chati like trainstake hallqi squarebet tabyour usual suspectshe loops poolsbig bike rider way toolittle way latetoo little yet lateis sityoure yelling loudlyshes rating trainssorry couldnt resist calling square numbers™square numbers™not square numbers™finally lets go full circle return word puzzledouble jump words™not double jump words™popularbedbugcolourdownpourfaultlesscommutepolysyllabicbipartisanasymptoteassumingpiccolosquireexponentoutvotekarateabductionboldlymuseumhumiditymahjongrotationmanpowerflybyamoebafrom selection puzzles tell quality essential make interesting puzzle™not puzzles without flaws good intrinsically related bad also tell quality puzzle might isnt necessarily desirable makes puzzle less interesting™good luckhint level thanks idea rubio leaping sets™ tags reasonhint level leaping sets™ mea culpa nay good ideahint level square numbers™ square wont help propertyhint level square numbers™ need find property manner decryptionhint level square numbers™ look hint could square useful hint hint look hint hint level square numbers™ textnumbersrightarrowtextsome sort squarerightarrowtextlettershint level square numbers™ particular looking cipher takes number puts sort square gets letter vice versa
26180	im excited share following riddle given two years ago finally solved last summer thinking long time desperation tried find solution online couldnt even find riddle anywhere else im excited see somebody knows riddle approach solutionthree mathematicians prison single cell able communicate way imprisoned arbitrary number dayseach cell single light bulb either given day warden tells mathematicians light system prison three modes neutral mode lightbulb independent othersbright mode two bulbs turn every day turns offdark mode two bulbs turn every day turns onall distributions necessarily uniformthe prison starts neutral mode unknown finite number days warden select either bright mode dark mode locked permanentlyafter countably infinitely many days passed mathematicians asked one warden picked may discuss strategy going cells communication afterwards unlimited capacities communicate remember strategies come two three need guess correctly escape ensure may assume axiom choice holds
73286	teapot riddle norulesi one word several meaningseach meanings teapot first second try figure word hints today less hints usualfirst hint first teapot elemental survive second teapot isnt elemental survive third teapot helps survive fourth teapot helps third teapot second last hint first teapot basic market principle second teapot basic presentation principle third teapot general principle fourth teapot comes principalgood luck fun last riddleand probz shahriar mahmud sajid making
32327	fun riddle hope like iti appear things brokenim things flawlessbut track meim wantedim cluelessim different allyou cant touch handhint go hint write words also numbershint probably trick okhint humor used alwayshint clueless slang synonymhint im error messagehint hint substatussesquestion iand thought easy one
75335	view first part herethe word broken partsmy first part small character book moviemy second part related company third part related rabbitmy whole sweet hint rabbit book hint expelliarmuswhat
85576	lie tennis ball soccer ball agree im small bottom first sometimes may even burst prefix rhymes app im earth map find cluster misterhint two balls mentioned spacevoters jproblems found correct answer also consider voting michael moschellas answer
58954	find way make adding operations symbols use symbols limited list good luckps add numbers equation
20037	im confident members find one easy applies please use spoiler hiding didnt understand last sentence guess one memberspuzzle running backwards helps move forwardsquestionwhat talking notesif get correct answer judged please include explanation still puzzled best fullest explanation judged upvoting everything puzzle buildup gets green tickanswers consist single word followed explanation title comments words please
15948	looking patterns could find onei found rules middle column always points direction first two first row always opposite last two second column always opposite still rules insufficientattribution epso online test
61006	actually puzzle per se im asking explanation puzzles answerthe puzzle goes like thisa man bought goat sold later bought goat back sold much profit makei know answer since man left extra units money hands last sale somebody insists profit used first profit buy back goat know logic error cant see explain using thought process profit
40528	two police officers respond domestic violence complaint house isnt first time responded complaint come house least half dozen times however joyce abused never willing file complaint arrived preventing anything matter much would like tothey expected another fruitless visit one different moment door opened see joyces face looks horribly bruised far worse previous visit unlike past excuse falling steps accidental collisions walls made joyce clearly tells police happened says getting worse begs officers protectionhowever police arrest husband even warn dont take action protect wife either even suggesting domestic abuse shelter resources fact act little sympathy situation allwhy arent helping womansome hints narrow possibilities think puzzle could likely solved without though abuse really happened police believe joyce police arent afraid provoking abuser making things worse joyce acting police authority act charges abuser joyces spouse third party police sympathetic joyce want help police ultimately manage protect joyce
3668	old one dont see herea man stepped tent rifle walked mile south mile east mile north shot bear front tent color bear
44629	deck playing cards eg poker cards assign every card unique number id every combination cards hand shall represented unique result number calculated card ids permutations cards must yield resulteg could enumerate cards simply add values however got result could differentiate solutionyou could write ids occur would different also solutionconstraintsno sorting allowed whatever formula card ids must able go orderthe id number assigned card must always positive integer exceed digitsthe unique result number must always positive integer exceed digitscalculating result given card id numbers must rely one basic operations questionswhat numbers assignhow calculate resultshow biggest possible result digits
61014	easily move state state although wont find texas old although young people theorize demise people want save dont like rock music something common also fan exotic animals almost cant find anywhere elsewhat
50777	part found information part required solve puzzlehaving identified el gato intends strike next charter one bureaus jets fly chicago along two fellow agents upon landing first agenda check police headquarters inform situation enlist assistance stopping whatever el gato plannedel gato eh said superintendent youve finished explanation know might actually something strange fax received couple hours ago gon na dismiss prank el gato sent hang put itthe superintendent shuffles papers around desk moment retrieves fax similar one received bureau signature upon reading youre immediately certain next part el gatos game eenie meenie miney mo exhibit shall go shines light quick strike tonight idea means says baffled superintendent numbers mean however already sat pulled pen ready crack codewhereabouts chicago el gato planning robhint think sequentially detectivesuper hint youre looking set coordinates point specific location chicago
56922	standard chess rules apply board rotated ie white pawns move upwards lateral thinking needed simply find one move white mates black kingthis puzzle created leonid kubbel
81497	puzzle inspired similar rules series puzzles sleafardefinition copycat chess opening sequence moves starting conventional starting position every move white including last one copied black identically resulting symmetrical position respect midhorizontal axis every move must legal last move doesnt checkmate hence name opening instead game shortest copycat chess opening rook captures another rook
85596	package orinoco finally arrivedits master chefs environmentallyfriendly measuring cup set comes measuring cups volume cup cup cup cup way cupbecause master chefs cups master featureswhen presence sufficient ingredient fill completely instantly fill capacity ingredient command riempirewhen presence sufficient ingredient fill completely command riempire nothingwhen full instantly completely empty command vuotarebecause also environmentallyfriendly cups cup instantly dissolves fresh mountain air one use upon emptied waste pollutionyou giant us gallon tub nutmeg empty gallon soup pot master chef know best soups must nutmeg ideally little possible making perfectly nuanced flavourusing set singleuse cups transfer nutmeg nutmeg tub soup bowl smallest nonzero amount nutmeg leave soup bowlfor example could transfer cup cup cup nutmeg soup bowl cup back tub left cup soup bowlthere course optimal solution puzzle extremely hard intuit opinion hence everyones best attempts welcome lower betterdisclaimer problem core mathematical isnt lateral thinking puzzle tricks disregard realistic physical limitations errors measurement left unreasonably tiny quantity nutmeg
42587	first ever try riddle hope guys enjoy im invisible im lost lose must pay cost among newborn stay learn slay two faces one true liewhat
3678	tournament played roundrobin pair players played match one defeated prove player every player either lost lost someone lost themformally prove direct edges complete undirected graph exists vertex every vertex reachable directed path length
110175	would enterretsubkcolbspelled backwards comment box press add comment button nothing happen theres letters using clicks totalyou end something like thisrequirementsyou may use mouse rightclick leftclick cursor movementyou may stay page imagine page locked screen new tabs new windows minimizing current window etcno userscripts extensions standard browser standard settingsnote pc puzzle might work phonesediti failed mention must assume fresh puzzle meaning incorporate later comments answers etc solution
38494	examples integers halve values decimal representations replaced
48740	use digits create number
30309	birthday yesterday girlfriend comes kidding around asked shed gotten something good said oh yeah big timewell course wanted know went computer typed url saved favoritesim going make work babe smiled wickedlythere picture heart screen password prompt underneathme cant birthdayher dont think im worth take give socks use new socksmehow supposed guess passwordher know said im numbers girlme yeah theres like billion numbersshe handed piece paperher thats im giving clue dummy think type three attempts get locked outme cant serious saidher half serious maybe youve tried twice youre really nice beg really hardme mean noteher clue try thinking might like iton one side paper bunch numbers word scrub capsscrubon side wrotedont slob babe use wipe dab face try cleanser bad boyi may mr clean im bad anyway tried numbers tried backwards luck know whats behind password really dont want beg help meupdatemy girlfriend came today didnt mention birthday thing weekher week hows going presentshe looking smug knew didnt get itme dont know cant figure outher dont listen im talking gave hints help stuff paperme listen even made notesi showed notes post didnt tell put internet didnt think would go bigher oh god really soooo sweet youre best babe listen wrongthings got kind personal ask password againmeso cant figure miss somethingher youve got everything need notes cant figure youre dumb babe dont worry super smart girlfriend long dont mess youll fineme whats passwordher well really nice havent heard nearly enough begging yetme tell many digits least thanks raystafarianher eight course kissed im going look socks case see younow help
44645	year year disrespect timedont keep looking waste primea lot happens underneathyou look beneathremember rome wasnt built dayi dont care think lostoh must tell im good hostdont lose tenacity believe capacityi like people wait rare traitim abstract like success fame hope fearhelp cope dont subtract distract dearhints days question im used make variety goods rest small bowls many times
97895	four fours famous puzzle made trivial logarithms puzzle take inspiration glen os challenge years back rules slightly different goal goal approximate pi highest accuracy per operation possible using four fours following operationsthe classic arithmetic operations timesdiv exponentiation logbase binary operations loga b ab may take logs positive real numbersthe root function binary operator sqrtbaunary operations cdot integer arguments cant use frac get sqrtpi unary negation square root sqrtcdot floorceiling rounding downup lfloorcdotrfloor lceil cdotrceilany operations allowed including double factorials decimal points addition following penaltyparentheses grouping purposes binomial coefficients etcconcatenation use single number without costing operation concatenate things fours eg cant concatenate sqrt get use four fours eg mshs answer lfloor rfloor allowedyour score equal number digits accuracy per operation used got approximation using n operations score fraclogpi anto avoid division must use least one operation example submit sqrt sqrtapprox operations score would befraclog pi sqrt approx
69224	another riddle came olden days feared name meant certain death nowadays describe gentle winds cold breath young hate always mean work older appreciate craftsmans handiwork quite riddle wet dry tell puzzle solvers igood luck everyone except quantumtwinkie editi added wordplay tag bit hint
63077	men river boat holds one person timethey cross river continue wayhowps uber helicopters bridges ropes anything else close river isnt swimmable
71277	tree bird landed started pulling leaves eventually boy came along ate bird tree grew back leaveswhat happenedhint happens regular basis
118384	made puzzle title says must make numbers using numbers order numbers must used allowed operators belowaddition subtraction multiplication divisionsquare roots exponentsfactorialsconcatenationfloor ceiling functionsparenthesesanything list must usedthose rules fun
24176	amreturned worldto save damnmy banners unfurled many names havebut one always trueno golden calvebut worship people cametheir weapon bringfew know true nameand familiar ring sneak awaynow battle oerpower saywho fear adore
83570	imperial war museum london theres box directional padlock one ever opened however found letter next one open box even letter tried save warned would attack left always attack left side captain always told right hand would trust word critical situation left alone insist much defending bridge fort right side unfortunately could never ask sure took madman right left army country javier rodriguezwhat key open directional lock
28281	group ten bandits stand flat desert pair distance apart tensions grow crack dawn bandit fires single bullet bandit closest perfect aim hit killedmust one live tell tale many could possibly survive
